ward,year,category,location,cost
1,2012,Alley Resurfacing,N WESTERN AVE & N CLAREMONT AVE & W NORTH AVE &,6354.0
1,2012,Alley Speed Hump,N WOOD ST & N HONORE ST & W AUGUSTA BLVD & W,2800.0
1,2012,Bollard,ON W BELMONT AVE FROM 2441 W TO N CAMPBELL AV,3150.0
1,2012,Curb & Gutter,ON N MAPLEWOOD AVE FROM W BELDEN AV (2300 N) TO W,19882.0
1,2012,Pavement Markings,W CHARLESTON ST & N WESTERN AVE,1000.0
1,2012,Pavement Markings,W ARMITAGE AVE & N MILWAUKEE AVE,400.0
1,2012,Pavement Markings,W DIVERSEY PKWY & N ROCKWELL ST,600.0
1,2012,Sidewalk,ON W BELDEN AVE FROM N TALMAN AV (2632 W) TO N,11954.0
1,2012,Sidewalk,ON N WOOD ST FROM W BEACH AV (1422 N) TO W LE,10065.0
1,2012,Sidewalk,ON N MARION CT FROM W DIVISION ST (1200 N) TO W,1594.0
1,2012,Street Resurfacing,ON N CAMPBELL AVE FROM W NORTH AV (1600 N) TO W,193749.0
1,2012,Street Resurfacing,ON N ROCKWELL ST FROM W CORTLAND ST (1900 N) TO W,73623.0
1,2012,Street Resurfacing,ON W JULIA CT FROM N STAVE ST (2728 W) TO Dead End,10588.0
1,2012,Street Resurfacing,ON W LE MOYNE ST FROM N OAKLEY BV (2300 W) TO N,19195.0
1,2012,Street Resurfacing,ON W CHARLESTON ST FROM N CAMPBELL AV (2450 W) TO,34143.0
1,2012,Street Resurfacing,ON N ROCKWELL ST FROM N MILWAUKEE AV (2125 N) TO,47986.0
1,2012,Street Speed Hump,ON N ELK GROVE AVE FROM N WOOD ST (1800 W) TO W,3700.0
1,2012,Street Speed Hump,ON N MARION CT FROM W DIVISION ST (1200 N) TO W,3700.0
1,2012,Street Speed Hump,ON N ROCKWELL ST FROM W FULLERTON AV (2400 N) TO W,3700.0
1,2012,Street Speed Hump,ON W ST PAUL AVE FROM N WINNEBAGO AV (2269 W) TO N,3700.0
1,2012,Floodlight,W POTOMAC AVE & N LEAVITT ST,2500.0
1,2012,Floodlight,N CAMPBELL AVE & W IOWA ST,500.0
1,2012,Pedestrian Countdown,N WESTERN AVE & W NORTH AVE,15011.0
1,2012,Street Light Arterial,W POTOMAC AVE & N LEAVITT ST,11000.0
1,2012,Street Light Residential,ON ROCKWELL FROM W BLOOMINGDALE AV (1800 N) TO,128000.0
1,2012,Street Light Upgrade,ON WINCHESTER FROM W AUGUSTA BV (1000 N) TO W,1400.0
1,2012,Street Light Upgrade,ON STAVE FROM W ARMITAGE AV (2000 N) TO W FRANCIS,700.0
1,2012,Street Light Upgrade,ON BINGHAM FROM W ARMITAGE AV (2000 N) TO W,350.0
1,2012,Street Light Upgrade,1300 N LEAVITT ST,700.0
1,2012,Street Light Upgrade,N CAMPBELL AVE & W IOWA ST,400.0
1,2012,Street Light Upgrade,ON SUPERIOR FROM N DAMEN AV (2000 W) TO N WOOD ST,1400.0
1,2012,Chicago Park District,Haas Park Field House,605000.0
1,2012,School Projects,Goethe School - Campus Park,100000.0
1,2012,School Projects,"LaSalle II Elementary School - playground )TPC=$25,000 2011-2013",25000.0
2,2012,Alley Apron,ON W VAN BUREN ST FROM 1534 W TO S LAFLIN ST (1500 W),11547.0
2,2012,Alley Apron,ON S ASHLAND AVE FROM 333 S TO W JACKSON BV (300 S),11545.0
2,2012,Alley Apron,ON S LOOMIS ST FROM S TO W FILLMORE ST (1050 S),8268.0
2,2012,Alley Apron,ON S LAFLIN ST FROM 1013 S TO W FILLMORE ST (1050 S),9686.0
2,2012,Alley Resurfacing,W MADISON ST & W MONROE ST & S WESTERN AVE & S,39539.0
2,2012,Alley Resurfacing,ON LOOMIS FROM W TAYLOR ST (1000 S) TO W FILLMORE,6638.0
2,2012,Alley Resurfacing,S MORGAN ST & S SANGAMON ST & W MONROE ST & W,12736.0
2,2012,Alley Resurfacing,S WABASH AVE & S WABASH AVE & E CERMAK RD & E,2981.0
2,2012,Bollard,ON S ASHLAND AVE FROM S TO W VAN BUREN ST (400 S),800.0
2,2012,Curb & Gutter,ON S CALUMET AVE FROM E 18TH ST (1800 S) TO E,2506.0
2,2012,Curb & Gutter,ON W HARRISON ST FROM S WASHTENAW AV (2700 W) TO S,73623.0
2,2012,Miscellaneous Other,Temporary Parking signs in WEst Loop,10000.0
2,2012,Miscellaneous Other,Congress Pkwy - Michigan and Wells Landscape & LED preservation,117050.0
2,2012,Miscellaneous Other,Martin Luther King Boulevard artwork installation,30000.0
2,2012,Sidewalk,ON S WABASH AVE FROM E 24 ST (2400 S) TO E 24 PL (2432 S),29712.0
2,2012,Sidewalk,ON N FRANCISCO AVE FROM W WARREN BV (23 N) TO W,3797.0
2,2012,Sidewalk,ON HARRISON FROM S CALIFORNIA AV (2800 W) TO S,21113.0
2,2012,Sidewalk,800 S STATE ST,3394.0
2,2012,Sidewalk,ON N CALIFORNIA AVE FROM W WASHINGTON BV (100 N),215.0
2,2012,Sidewalk,ON S JEFFERSON ST FROM W TILDEN ST (426 S) TO W VAN,19182.0
2,2012,Street Resurfacing,ON S LAFLIN ST FROM W POLK ST (800 S) TO W FILLMORE,107489.0
2,2012,Street Resurfacing,ON W POLK ST FROM S FRANCISCO AV (2900 W) TO S,66167.0
2,2012,Street Resurfacing,ON S SANGAMON ST FROM W JACKSON BV (300 S) TO Dead,135686.0
2,2012,Street Resurfacing,ON S THROOP ST FROM W WASHBURNE AV (1225 S) TO W,35504.0
2,2012,Street Resurfacing,ON S THROOP ST FROM W TAYLOR ST (1000 S) TO W,108718.0
2,2012,Floodlight,ON LAKE FROM N ALBANY AV (3100 W) TO N,5500.0
2,2012,Left-Turn Arrow,S CLARK ST & W HARRISON ST,11500.0
2,2012,Street Light Piggy Back,ON 32 FROM DR. MARTIN LUTHER KING JR. DR (358 E) TO S,5400.0
2,2012,Street Light Piggy Back,ON 24 FROM S STATE ST (0 E) TO S INDIANA AV (200 E),8100.0
2,2012,Street Light Pole Painting,ON GREEN FROM W ADAMS ST (200 S) TO W VAN BUREN ST,1500.0
2,2012,Street Light Pole Painting,ON ROOSEVELT FROM S LOOMIS ST (1400 W) TO S,6600.0
2,2012,Street Light Pole Painting,ON VAN BUREN FROM S FRANKLIN ST (300 W) TO S,2400.0
2,2012,Street Light Pole Painting,ON S HOYNE AVE FROM W CONGRESS PW (500 S) TO W,1800.0
2,2012,Street Light Pole Painting,ON POLK FROM S PAULINA ST (1700 W) TO S DAMEN AV,5000.0
2,2012,Street Light Pole Painting,ON CANAL FROM W 14 PL (1440 S) TO W ROOSEVELT RD,12000.0
2,2012,Street Light Pole Painting,ON HERMITAGE FROM W TAYLOR ST (1000 S) TO W,2400.0
2,2012,Street Light Pole Painting,ON MICHIGAN FROM E ROOSEVELT RD (1200 S) TO E,18500.0
2,2012,Street Light Pole Painting,ON 24 FROM S STATE ST (0 E) TO S INDIANA AV (200 E),4200.0
2,2012,Street Light Pole Painting,ON PAULINA FROM W MADISON ST (0 N) TO W JACKSON,3600.0
2,2012,Street Light Pole Painting,ON S STATE ST FROM W ROOSEVELT RD (1200 S) TO W 15 ST,14100.0
2,2012,Street Light Pole Painting,ON ADAMS FROM S MORGAN ST (1000 W) TO S GREEN ST,2400.0
2,2012,Street Light Pole Painting,ON HARRISON FROM S OAKLEY BV (2300 W) TO S DAMEN,12600.0
2,2012,Street Light Pole Painting,ON VAN BUREN FROM S STATE ST (0 E) TO S CONGRESS,8600.0
2,2012,Street Light Pole Painting,ON MONROE FROM S MORGAN ST (1000 W) TO S PEORIA ST,2400.0
2,2012,Street Light Pole Painting,ON PAULINA FROM W HARRISON ST (600 S) TO W POLK ST,3300.0
2,2012,Street Light Pole Painting,ON S WOLCOTT AVE FROM W GRENSHAW ST (1120 S) TO W,1200.0
2,2012,Street Light Pole Painting,ON LAKE FROM N ALBANY AV (3100 W) TO N,6000.0
2,2012,Street Light Pole Painting,ON TAYLOR FROM S LOOMIS ST (1400 W) TO S RACINE AV,7500.0
2,2012,Street Light Pole Painting,ON W CONGRESS PKWY FROM W OGDEN AV (1875 W) TO S,6000.0
2,2012,Street Light Pole Painting,ON ROOSEVELT FROM S ASHLAND AV (1600 W) TO S,24000.0
2,2012,Street Light Pole Painting,ON CONGRESS FROM S MORGAN ST (1000 W) TO E,5700.0
2,2012,Street Light Pole Painting,ON 32 FROM DR. MARTIN LUTHER KING JR. DR (358 E) TO S,1500.0
2,2012,Street Light Pole Painting,ON MAYPOLE FROM N OAKLEY BV (2300 W) TO N,2400.0
2,2012,Street Light Pole Painting,ON S WOOD ST FROM W ROOSEVELT RD (1200 S) TO W,1200.0
2,2012,Street Light Upgrade,ON MONROE FROM S MORGAN ST (1000 W) TO S PEORIA ST,3200.0
2,2012,Street Light Upgrade,ON PAULINA FROM W MADISON ST (0 N) TO W JACKSON,4000.0
2,2012,Street Light Upgrade,ON S WOLCOTT AVE FROM W GRENSHAW ST (1120 S) TO W,2400.0
2,2012,Street Light Upgrade,ON ADAMS FROM S LEAVITT ST (2200 W) TO S SEELEY AV,1750.0
2,2012,Street Light Upgrade,ON ROOSEVELT FROM S LOOMIS ST (1400 W) TO S,6000.0
2,2012,Street Light Upgrade,317 S CAMPBELL AVE,350.0
2,2012,Street Light Upgrade,201 S ASHLAND AVE,350.0
2,2012,Street Light Upgrade,ON 11 FROM S STATE ST (0 E) TO S MICHIGAN AV (120 E),400.0
2,2012,Street Light Upgrade,ON POLK FROM S STATE ST (0 E) TO S FINANCIAL PL (146,1200.0
2,2012,Street Light Upgrade,ON S HOYNE AVE FROM W CONGRESS PW (500 S) TO W,2400.0
2,2012,Street Light Upgrade,ON PAULINA FROM W HARRISON ST (600 S) TO W POLK ST,4400.0
2,2012,Street Light Upgrade,157 S ASHLAND AVE,350.0
2,2012,Street Light Upgrade,ON S STATE ST FROM W ROOSEVELT RD (1200 S) TO W 15 ST,18800.0
2,2012,Street Light Upgrade,ON CANAL FROM W 14 PL (1440 S) TO W ROOSEVELT RD,14000.0
2,2012,Street Light Upgrade,ON ADAMS FROM S MORGAN ST (1000 W) TO S GREEN ST,3200.0
2,2012,Street Light Upgrade,ON HERMITAGE FROM W TAYLOR ST (1000 S) TO W,3200.0
2,2012,Street Light Upgrade,3550 S GILES AVE,350.0
2,2012,Street Light Upgrade,ON BALBO FROM S STATE ST (0 E) TO S MICHIGAN AV (120,1600.0
2,2012,Street Light Upgrade,ON GREEN FROM W ADAMS ST (200 S) TO W VAN BUREN ST,1600.0
2,2012,Street Light Upgrade,ON CONGRESS FROM S MORGAN ST (1000 W) TO E,7600.0
2,2012,Street Light Upgrade,ON VAN BUREN FROM S LEAVITT ST (2200 W) TO S SEELEY,1750.0
2,2012,Street Light Upgrade,ON HARRISON FROM S STATE ST (0 E) TO S WABASH AV (44,400.0
2,2012,Street Light Upgrade,ON MAYPOLE FROM N OAKLEY BV (2300 W) TO N,2000.0
2,2012,Street Light Upgrade,ON STATE FROM W HARRISON ST (600 S) TO W ROOSEVELT,18000.0
2,2012,Street Light Upgrade,ON S WOOD ST FROM W TAYLOR ST (1000 S) TO W,1200.0
2,2012,Street Light Upgrade,ON 24 FROM S STATE ST (0 E) TO S INDIANA AV (200 E),4800.0
2,2012,Street Light Upgrade,ON HOYNE FROM W MADISON ST (0 N) TO W MONROE ST,1400.0
2,2012,Street Light Upgrade,ON POLK FROM S PAULINA ST (1700 W) TO S DAMEN AV,6400.0
2,2012,Street Light Upgrade,1319 S STATE ST,21000.0
2,2012,Street Light Upgrade,547 S CLARK ST,350.0
2,2012,Street Light Upgrade,ON LAKE FROM N MOZART ST (2832 W) TO N SACRAMENTO,8000.0
2,2012,Street Light Upgrade,ON W CONGRESS PKWY FROM W OGDEN AV (1875 W) TO S,8000.0
2,2012,Street Light Upgrade,ON HARRISON FROM S OAKLEY BV (2300 W) TO S DAMEN,12000.0
2,2012,Street Light Upgrade,ON 32 FROM DR. MARTIN LUTHER KING JR. DR (358 E) TO S,2000.0
2,2012,Street Light Upgrade,ON SEELEY FROM W JACKSON BV (300 S) TO W VAN BUREN,1400.0
2,2012,Street Light Upgrade,ON MONROE FROM S RACINE AV (1200 W) TO S GREEN ST,5250.0
2,2012,Street Light Upgrade,ON VAN BUREN FROM S GREEN ST (832 W) TO W TILDEN ST,5600.0
2,2012,Traffic Equipment,ON HARRISON FROM S OAKLEY BV (2300 W) TO S DAMEN,2400.0
2,2012,Traffic Equipment,ON 24 FROM S STATE ST (0 E) TO S INDIANA AV (200 E),400.0
2,2012,Traffic Equipment,ON S STATE ST FROM W ROOSEVELT RD (1200 S) TO W 15 ST,2750.0
2,2012,Traffic Equipment,ON PAULINA FROM W HARRISON ST (600 S) TO W POLK ST,200.0
2,2012,Traffic Equipment,ON STATE FROM W HARRISON ST (600 S) TO W ROOSEVELT,25650.0
2,2012,Traffic Equipment,ON ROOSEVELT FROM S ASHLAND AV (1600 W) TO S,11000.0
2,2012,Traffic Equipment,W ROOSEVELT RD & S WOOD ST,3500.0
2,2012,Traffic Equipment,ON STATE FROM W CONGRESS PW (500 S) TO W HARRISON,8000.0
2,2012,Traffic Equipment,ON MICHIGAN FROM E ROOSEVELT RD (1200 S) TO E,19500.0
2,2012,Traffic Equipment,ON ASHLAND FROM W MADISON ST (0 N) TO W,5450.0
2,2012,Traffic Equipment,W ROOSEVELT RD & S PAULINA ST,3500.0
2,2012,Traffic Equipment,W ROOSEVELT RD & S ASHLAND W AVE,3500.0
2,2012,Traffic Equipment,ON JEFFERSON FROM W MADISON ST (0 N) TO W ADAMS ST,1550.0
3,2012,Alley Apron,ON S MICHIGAN AVE FROM 4944 S TO E 49 ST (4900 S),8666.0
3,2012,Concrete Alley,1503 S State,216149.0
3,2012,Curb & Gutter,ON E 37TH PL FROM S STATE ST (0 E) TO S WABASH AV (44,51363.0
3,2012,Curb & Gutter,ON S PRINCETON AVE FROM W 48TH PL (4850 S) TO W 50TH,23977.0
3,2012,"In-Road ""State Law Stop",S STATE ST & W 23RD ST,550.0
3,2012,Miscellaneous Other,"4501-33 & 4524-50 S McDowell, & 1400 W 46th St Tree planting",14166.0
3,2012,Miscellaneous Other,4434 S DR MARTIN LUTHER KING JR DR,413.0
3,2012,Miscellaneous Other,4700 S LASALLE ST Decorative Plaza Planter Fencing,3370.0
3,2012,Miscellaneous Other,E 43RD ST & S DR MARTIN LUTHER KING JR DR E two decorative baskets,680.0
3,2012,Miscellaneous Other,8 decorative garbage cans decorative garbage cans,11450.0
3,2012,Pavement Markings,W 46TH PL & S SHIELDS AVE,300.0
3,2012,Sidewalk,ON S CALUMET AVE FROM E 46TH ST (4600 S) TO E 47TH ST,11175.0
3,2012,Sidewalk,ON W SWANN ST FROM S PRINCETON AV (300 W) TO S,643.0
3,2012,Sidewalk,ON DR MARTIN LUTHER KING JR DR FROM E 44 ST (4400 S),8979.0
3,2012,Sidewalk,ON E 50TH PL FROM S WASHINGTON PK (432 E) TO S,30507.0
3,2012,Sidewalk,ON S SHIELDS AVE FROM W SWANN ST (4642 S) TO W 47 ST,22651.0
3,2012,Street Resurfacing,ON E 42ND ST FROM S STATE ST (0 E) TO S MICHIGAN AV,94958.0
3,2012,Street Resurfacing,ON FORRESTVILLE FROM E 48 ST (4800 S) TO E 49 ST (4900 S),6790.0
3,2012,Street Resurfacing,ON S CALUMET AVE FROM E PERSHING RD (3900 S) TO E 41,135801.0
3,2012,Street Resurfacing,ON S PRINCETON AVE FROM W ROOT ST (4134 S) TO W 43 ST,176667.0
3,2012,Street Resurfacing,ON S PRAIRIE AVE FROM E 33 BV (3300 S) TO E 35 ST (3500 S),106066.0
3,2012,Street Resurfacing,ON S PRAIRIE AVE FROM E 48 ST (4800 S) TO E 51 ST (5100 S),188861.0
3,2012,Street Speed Hump,ON S CALUMET AVE FROM E 43 ST (4300 S) TO E 44 ST (4400,3700.0
3,2012,Street Speed Hump,ON S FEDERAL ST FROM W 13 ST (1299 S) TO W 14 ST (1400 S),5550.0
3,2012,Street Speed Hump,ON S LAFLIN ST FROM W 46 ST (4600 S) TO W 47 ST (4700 S),3700.0
3,2012,Floodlight,ON CULLERTON FROM S STATE ST (0 E) TO S WABASH AV Adding Floodlight with Mast Arm,1200.0
3,2012,Floodlight,ON 43 FROM S CALUMET AV (320 E) TO S PRAIRIE AV (236 E) Install floodlights on El tracks & New Controller,10000.0
3,2012,Street Light Residential,ON LAFAYETTE FROM W GARFIELD BV (5500 S) TO W 57 ST,128000.0
3,2012,Street Light Upgrade,342 W 42ND PL,350.0
3,2012,Street Light Upgrade,ON INDIANA FROM E 31 ST (3100 S) TO E GARFIELD BV (5500,43800.0
3,2012,Street Light Upgrade,501 E 44TH PL,350.0
3,2012,Street Light Upgrade,ON 43 FROM S MICHIGAN AV (120 E) TO S INDIANA AV (200,1800.0
3,2012,Street Light Upgrade,5048 S INDIANA AVE,427.0
3,2012,Street Light Upgrade,ON PRINCETON FROM W GARFIELD BV (5500 S) TO W 57 ST,2100.0
3,2012,Street Light Upgrade,ON CULLERTON FROM S STATE ST (0 E) TO S WABASH AV,800.0
3,2012,Street Light Upgrade,4753 S FORRESTVILLE AVE,500.0
4,2012,Alley Resurfacing,E 47TH ST & E 47TH PL & S DREXEL BLVD & S COTTAGE,18351.0
4,2012,Alley Resurfacing,S GREENWOOD AVE & S ELLIS AVE & E 47TH ST & E 48TH,5844.0
4,2012,Curb & Gutter,ON S DREXEL BLVD FROM E 41 ST (4114 S) TO E 42 PL (4228,60751.0
4,2012,Curb & Gutter,ON E 42ND PL FROM S COTTAGE GROVE AV (800 E) TO S,13521.0
4,2012,Curb & Gutter,ON E BOWEN AVE FROM S ST LAWRENCE AV (600 E) TO S,29629.0
4,2012,Curb & Gutter,ON S BERKELEY AVE FROM E 44 ST (4400 S) TO E 45 ST (4500,4216.0
4,2012,Miscellaneous Other,Harper Ave.,200000.0
4,2012,Miscellaneous Other,ON 44 FROM S GREENWOOD AV (1100 E) TO S LAKE PARK,19903.0
4,2012,Sidewalk,ON S KIMBARK AVE FROM E HYDE PARK BV (5100 S) TO E,20253.0
4,2012,Sidewalk,ON E 47TH ST FROM S LANGLEY AV (700 E) TO S EVANS AV,16421.0
4,2012,Sidewalk,ON E OAKWOOD BLVD FROM S VINCENNES AV (544 E) TO S,22812.0
4,2012,Sidewalk,ON E 48TH ST FROM S GREENWOOD AV (1100 E) TO S,28386.0
4,2012,Sidewalk,ON S RIDGEWOOD CT FROM E 54 ST (5322 S) TO Dead End,11468.0
4,2012,Sidewalk,ON S WOODLAWN AVE FROM E 52 ST (5150 S) TO E 53 ST,4335.0
4,2012,Sidewalk,ON W 46TH ST FROM S GREENWOOD AV (1100 E) TO S,71664.0
4,2012,Sidewalk,ON S GREENWOOD AVE FROM E 47 ST (4700 S) TO E 48 ST,22887.0
4,2012,Street Resurfacing,ON E 54TH ST FROM S WOODLAWN AV (1200 E) TO S,22148.0
4,2012,Street Resurfacing,ON S DORCHESTER AVE FROM E 50 ST (5000 S) TO E HYDE,34476.0
4,2012,Street Resurfacing,ON E 40TH ST FROM S COTTAGE GROVE AV (800 E) TO S,15299.0
4,2012,Street Resurfacing,ON E 42ND ST FROM S VINCENNES AV (515 E) TO S ST,49392.0
4,2012,Street Resurfacing,ON E 37TH ST FROM S ELLIS AV (792 E) TO S LAKE PARK AV,52350.0
4,2012,Street Resurfacing,ON S EVANS AVE FROM E 50 PL (5032 S) TO E 51 ST (5100 S),39743.0
4,2012,Street Resurfacing,ON S ELLIS AVE FROM E 37 ST (3640 S) TO E PERSHING RD,32357.0
4,2012,Street Resurfacing,ON S EAST END AVE FROM E 50 ST (5000 S) TO S HYDE PARK,57448.0
4,2012,Street Resurfacing,ON S KENWOOD AVE FROM E 48 ST (4800 S) TO E 49 ST (4900,38034.0
4,2012,Street Resurfacing,ON E 50TH ST FROM S ELLIS AV (1001 E) TO S GREENWOOD,58378.0
4,2012,Street Resurfacing,ON S CORNELL AVE FROM E HYDE PARK BV (5100 S) TO E 53,78733.0
4,2012,Street Resurfacing,ON S RHODES AVE FROM E 31 PL (3132 S) TO E 33 ST (3300 S),89974.0
4,2012,Street Resurfacing,ON E 49TH ST FROM S DREXEL (W) AV(863 E) TO S ELLIS AV,41730.0
4,2012,Street Light Pole Painting,ON BERKELEY FROM E 41 PL (4132 S) TO E 42 PL (4228 S),800.0
4,2012,Street Light Upgrade,ON HARPER FROM E 53 ST (5242 S) TO Dead End (5430 S),3850.0
4,2012,Street Light Upgrade,ON 41 FROM S DREXEL AV (900 E) TO S ELLIS AV (942 E),700.0
4,2012,Street Light Upgrade,ON FORRESTVILLE FROM E 48 ST (4800 S) TO E 49 ST (4900 S),1400.0
4,2012,Street Light Upgrade,ON CHAMPLAIN FROM E 43 ST (4300 S) TO E 44 ST (4400 S),1400.0
4,2012,Street Light Upgrade,ON S ELLIS AVE FROM E 43 ST (4300 S) TO E 44 ST (4400 S),1200.0
4,2012,Chicago Park District,Sumac Park Playground - 4201 S. Champlain,150000.0
5,2012,Miscellaneous Other,ON E 68TH ST FROM S STONY ISLAND AVE E (1600 E) TO S,25000.0
5,2012,Miscellaneous Other,ON E 68TH ST FROM S STONY ISLAND AVE E (1600 E) TO S planter box,12595.0
5,2012,Miscellaneous Other,"ON E 68TH ST FROM S STONY ISLAND AVE E (1600 E) TO S Lights, furniture",454404.0
5,2012,Street Light Residential,ON E 68TH ST FROM S CREGIER AVE (1800 E) TO S STONY,250000.0
5,2012,Street Light Residential,ON ELLIS FROM E 71 ST (7100 S) TO E 73 ST (7300 S),144000.0
5,2012,Street Light Residential,ON DORCHESTER FROM E 67 ST (6700 S) TO E 71 ST (7100 S),288000.0
5,2012,Street Light Residential,ON EAST END FROM E 69 ST (6900 S) TO E 71 ST (7100 S),144000.0
5,2012,Street Light Upgrade,ON 60 FROM S BLACKSTONE AV (1436 E) TO S STONY,2000.0
6,2012,Miscellaneous Other,E 83RD ST & S DR MARTIN LUTHER KING JR DR crosswalk markings,1166.0
6,2012,Street Resurfacing,ON E 85TH ST FROM S STATE ST (0 E) TO S WABASH AV (44,38833.0
6,2012,Street Light Residential,ON 66 FROM S UNION AV (700 W) TO S HALSTED ST (800 W),64000.0
6,2012,Street Light Residential,ON UNION FROM W 66 ST (6600 S) TO W MARQUETTE RD,64000.0
6,2012,Street Light Residential,ON ST LAWRENCE FROM E 71 ST (7100 S) TO E 87 ST (8700 S),1152000.0
7,2012,Curb & Gutter,ON S CHAPPEL AVE FROM E 97 ST (9700 S) TO E 98 ST (9800,100076.0
7,2012,Curb & Gutter,ON S PAXTON AVE FROM E 90 ST (9000 S) TO E 89 ST (8900 S),150638.0
7,2012,Curb & Gutter,ON E 74TH ST FROM S OGLESBY AV (2332 E) TO S OGLESBY,3657.0
7,2012,Curb & Gutter,ON CRANDON FROM E 96 ST (9540 S) TO E 97 ST (9713 S),68566.0
7,2012,Curb & Gutter,ON S PHILLIPS AVE FROM E 90 ST (9000 S) TO E 91 ST (9100 S),175674.0
7,2012,Curb & Gutter,ON S PAXTON AVE FROM E 101 ST (10100 S) TO E 100 ST,183815.0
7,2012,Curb & Gutter,ON S OGLESBY AVE FROM E 95 ST (9500 S) TO E 96 ST (9540,5452.0
7,2012,Curb & Gutter,ON S CRANDON AVE FROM E 96 ST (9540 S) TO E 97 ST (9713,89581.0
7,2012,Curb & Gutter,ON S OGLESBY AVE FROM E 74 ST (7400 S) TO E 73 ST (7300,121057.0
7,2012,Sidewalk,ON S EUCLID AVE FROM E 95 ST (9500 S) TO E 96 ST (9600 S),1768.0
7,2012,Sidewalk,ON E 79TH ST FROM S EXCHANGE (W) AV(2918 E) TO S,17046.0
7,2012,Sidewalk,ON S LUELLA AVE FROM E 73 ST (7300 S) TO E 74 ST (7400 S),2739.0
7,2012,Sidewalk,ON S SAGINAW AVE FROM E 93 ST (9300 S) TO E 94 ST (9400,7658.0
7,2012,Sidewalk,ON S ESSEX AVE FROM E 83 ST (8300 S) TO E 84 ST (8400 S),30458.0
7,2012,Sidewalk,ON S ESCANABA AVE FROM E 79 ST (7900 S) TO E 80 ST (8000,6279.0
7,2012,Sidewalk,ON EXCHANGE FROM E 75 ST (7470 S) TO E 76 ST (7570 S),6668.0
7,2012,Street Resurfacing,ON E 74TH ST FROM S COLES AV (2646 E) TO S SOUTH,42840.0
7,2012,Street Resurfacing,ON S CRANDON AVE FROM E 76 ST (7600 S) TO E 78 ST (7800,128952.0
7,2012,Street Resurfacing,ON S KINGSTON AVE FROM E 81 ST (8100 S) TO E 82 ST (8200,75601.0
7,2012,Street Resurfacing,ON S CHAPPEL AVE FROM E 97 ST (9700 S) TO E 98 ST (9800,41597.0
7,2012,Street Resurfacing,ON S CRANDON AVE FROM E 100 ST (10000 S) TO E 101 ST,26510.0
7,2012,Street Speed Hump,ON S BURNHAM AVE FROM E 77 ST (7700 S) TO E 78 ST (7800,3700.0
7,2012,Street Speed Hump,ON E CHELTENHAM PL FROM S COLES AV (3032 E) TO S,1850.0
7,2012,Street Speed Hump,ON S COLES AVE FROM E 72 ST (7130 S) TO E 73 ST (7231 S),3700.0
7,2012,Street Speed Hump,ON S PHILLIPS AVE FROM E 92 ST (9200 S) TO E 93 ST (9300 S),3700.0
7,2012,Street Speed Hump,ON S BURNHAM AVE FROM E 78 ST (7800 S) TO E 79 ST (7900,3700.0
7,2012,Street Speed Hump,ON S KINGSTON AVE FROM E 73 ST (7300 S) TO E 75 ST (7500,7400.0
7,2012,Street Speed Hump,ON E 89TH ST FROM S CRANDON AV (2300 E) TO S OGLESBY,1850.0
7,2012,Street Speed Hump,ON S CRANDON AVE FROM E 100 ST (10000 S) TO E 101 ST,3700.0
7,2012,Street Speed Hump,ON S LUELLA AVE FROM E 75 ST (7500 S) TO E 76 ST (7600 S),3700.0
8,2012,Alley Resurfacing,W 75TH ST & W 76TH ST & S RIDGELAND AVE & S CREGIER,3257.0
8,2012,Bollard,ON S CONSTANCE AVE FROM 7500 S TO E 75 ST (7500 S),2520.0
8,2012,Curb & Gutter,ON S UNIVERSITY AVE FROM E 80 ST (8000 S) TO E 81 ST,5436.0
8,2012,Curb & Gutter,ON E 83RD ST FROM S CRANDON AV (2300 E) TO S OGLESBY,57537.0
8,2012,Curb & Gutter,ON S BENNETT AVE FROM E 77 ST (7700 S) TO E 78 ST (7800,10035.0
8,2012,Curb & Gutter,ON S CONSTANCE AVE FROM E 85 ST (8500 S) TO E 86 ST,3767.0
8,2012,Curb & Gutter,ON E 86TH ST FROM S DANTE AV (1433 E) TO S,22199.0
8,2012,Sidewalk,ON S CREGIER AVE FROM E 85 ST (8500 S) TO E 86 ST (8600 S),28180.0
8,2012,Sidewalk,ON S DREXEL AVE FROM E 98 ST (9800 S) TO E 99 ST (9900 S),37672.0
8,2012,Sidewalk,ON S EUCLID AVE FROM E 74 ST (7400 S) TO E 75 ST (7500 S),30090.0
8,2012,Sidewalk,ON S EAST END AVE FROM E 93 ST (9300 S) TO E 94 ST (9400,19180.0
8,2012,Sidewalk,ON S OGLESBY AVE FROM E 88 ST (8800 S) TO E 89 ST (8900,20831.0
8,2012,Sidewalk,ON S AVALON AVE FROM E 97 (N) ST(9656 S) TO E 98 ST,2414.0
8,2012,Sidewalk,ON S MARYLAND AVE FROM E 98 ST (9800 S) TO E 99 ST,94743.0
8,2012,Sidewalk,ON E 74TH ST FROM S BALDWIN AV (1900 E) TO S JEFFERY,2343.0
8,2012,Sidewalk,ON S JEFFERY BLVD FROM E 85 ST (8500 S) TO E 86 ST (8600,71948.0
8,2012,Sidewalk,ON S BLACKSTONE AVE FROM E 81 ST (8100 S) TO E 82 ST,12213.0
8,2012,Sidewalk,ON S KIMBARK AVE FROM S KENWOOD AV (8414 S) TO E 85,9104.0
8,2012,Sidewalk,ON S LUELLA AVE FROM E 84 ST (8400 S) TO E 85 ST (8500 S),1973.0
8,2012,Street Bump Outs,ON S CREGIER AVE FROM E 91 ST (9100 S) TO E 92 ST (9200 S),15188.0
8,2012,Street Resurfacing,ON S BENNETT AVE FROM E 88 ST (8800 S) TO E 89 ST (8900,70500.0
8,2012,Street Resurfacing,ON E 88TH ST FROM S CRANDON AV (2300 E) TO S OGLESBY,15659.0
8,2012,Street Speed Hump,ON S CORNELL AVE FROM E 89 ST (8900 S) TO E 90 ST (9000,3700.0
8,2012,Street Speed Hump,ON S DORCHESTER AVE FROM E 84 ST (8400 S) TO E 85 ST,3700.0
8,2012,Street Light Residential,ON 85 FROM Dead End (1269 E) TO S AVALON AV (1272 E),6761.0
8,2012,Street Light Residential,ON CLYDE FROM E 79 ST (7900 S) TO E 81 ST (8100 S),128000.0
8,2012,Street Light Residential,ON CRANDON FROM E 83 ST (8300 S) TO E 85 ST (8500 S),128000.0
8,2012,Street Light Residential,ON UNIVERSITY FROM E 95 ST (9500 S) TO E 97 ST (9700 S),128000.0
8,2012,Street Light Residential,ON DANTE FROM E 79 ST (7900 S) TO E 81 ST (8100 S),128000.0
8,2012,Street Light Residential,ON INGLESIDE FROM E 97 ST (9700 S) TO E 99 ST (9900 S),128000.0
8,2012,Street Light Residential,ON AVALON FROM E 85 ST (8500 S) TO E 87 ST (8700 S),128000.0
8,2012,Street Light Upgrade,8836 S EUCLID AVE,350.0
8,2012,Street Light Upgrade,837 E 88TH PL,350.0
8,2012,Street Light Upgrade,1837 E 90TH ST,350.0
9,2012,Alley Speed Hump,S PARNELL AVE & S NORMAL & E 99TH ST & E 100TH ST,700.0
9,2012,Bollard,ON S LAFAYETTE AVE FROM 10234 S TO W 102 ST (10200 S),630.0
9,2012,Bollard,ON S PRAIRIE AVE FROM 10714 S TO E 107 ST (10700 S),630.0
9,2012,Curb & Gutter,ON S LAFAYETTE AVE FROM W 100 ST (10000 S) TO W 101 ST,79707.0
9,2012,Curb & Gutter,ON E 122ND PL FROM S STATE ST (0 E) TO S MICHIGAN AV,93931.0
9,2012,Curb & Gutter,ON S INDIANA AVE FROM E 116 ST (11638 S) TO E 117 ST,137919.0
9,2012,Curb & Gutter,ON E 93RD ST FROM DR. MARTIN LUTHER KING JR. DR (400,99235.0
9,2012,Curb & Gutter,ON E 99TH PL FROM S STATE ST (0 E) TO Dead End (50 E),48865.0
9,2012,Guardrail,ON E 114TH PL FROM 137 E TO S EDBROOKE AV (132 E),1471.0
9,2012,Sidewalk,ON S PRAIRIE AVE FROM E 101 ST (10100 S) TO E 102 ST,23421.0
9,2012,Sidewalk,ON E 119TH PL FROM S STATE ST (0 E) TO S MICHIGAN AV,55284.0
9,2012,Sidewalk,ON S EBERHART AVE FROM E 104 ST (10400 S) TO E 105 ST,109555.0
9,2012,Sidewalk,ON E 101ST PL FROM S ST LAWRENCE AV (600 E) TO S,3377.0
9,2012,Sidewalk,ON S PARNELL AVE FROM W 102 ST (10200 S) TO W 103 ST,89121.0
9,2012,Sidewalk,ON S WENTWORTH AVE FROM W 122 ST (12200 S) TO W 123,3427.0
9,2012,Street Resurfacing,ON W BRAYTON ST FROM W 126 PL (120 W) TO S,16046.0
9,2012,Street Resurfacing,ON S UNION AVE FROM W 127 ST (12700 S) TO W 129 PL,164345.0
9,2012,Street Resurfacing,ON E 133RD ST FROM S RIVERDALE AV (560 E) TO S ST,39039.0
9,2012,Street Resurfacing,ON S FORRESTVILLE AVE FROM E 132 ST (13200 S) TO E 132,11298.0
9,2012,Street Resurfacing,ON E 122ND ST FROM S MICHIGAN AV (100 E) TO S,35254.0
9,2012,Street Resurfacing,ON S LOWE AVE FROM W 128 PL (12832 S) TO W 129 PL (12930,48991.0
9,2012,Street Resurfacing,ON S NORMAL AVE FROM W 128 PL (12832 S) TO W 129 PL,49963.0
9,2012,Street Resurfacing,ON S CORLISS AVE FROM E 111 ST (11100 S) TO E 114 ST,195615.0
9,2012,Street Light Upgrade,ON 105 FROM S RHODES AV (532 E) TO S DAUPHIN AV (604,1050.0
9,2012,Street Light Upgrade,ON PERRY FROM W 121 ST (12100 S) TO W 122 ST (12200 S),1400.0
9,2012,Street Light Upgrade,ON 104 FROM S RHODES AV (532 E) TO S DAUPHIN AV (623,1050.0
9,2012,High Definition Camera,"POD Camera - 10700 S. Michigan (TPC = $22,500 - 2013 menu",22500.0
9,2012,School Projects,Poe School - Playground,7115.0
