ward,year,category,location,cost
25,2012,Miscellaneous Other,W 18TH ST & S LOOMIS BLVD Monument Stone Repair,7030.0
25,2012,Miscellaneous Other,W 18TH ST & S PAULINA ST Bike Racks,1500.0
25,2012,Sidewalk,ON W 19TH ST FROM S BISHOP ST (1444 W) TO S LAFLIN ST,25259.0
25,2012,Sidewalk,ON W 23RD ST FROM S HOYNE AV (2100 W) TO S LEAVITT,2628.0
25,2012,Sidewalk,ON S HOYNE AVE FROM W 23 PL (2332 S) TO W 23 PL (2332 S),5118.0
25,2012,Sidewalk,ON W 18TH ST FROM S PAULINA ST (1700 W) TO S WOOD ST,11634.0
25,2012,Sidewalk,ON S BLUE ISLAND AVE FROM W 18 ST (1800 S) TO W 18 ST,9305.0
25,2012,Sidewalk,ON W 22ND PL FROM S HOYNE AV (2100 W) TO S LEAVITT,16217.0
25,2012,Street Resurfacing,ON W VERNON PARK PL FROM S MORGAN ST (950 W) TO S,106728.0
25,2012,Street Resurfacing,ON S CARPENTER ST FROM W POLK ST (800 S) TO W,55597.0
25,2012,Street Speed Hump,ON W 16TH ST FROM S ASHLAND AV (1600 W) TO S PAULINA,3700.0
25,2012,Floodlight,ON SANGAMON FROM W 21 ST (2100 S) TO W CULLERTON,3000.0
25,2012,Street Light Upgrade,927 W CULLERTON ST,350.0
25,2012,Chicago Park District,Claremont Playlot Park,75000.0
25,2012,Chicago Park District,"Sheridan Park - 2012 (TPC = $185,000) , 2013 menu",185000.0
25,2012,Chicago Park District,Harrison Park - Athletic Field,100000.0
25,2012,High Definition Camera,958 W. Cullerton,22500.0
25,2012,High Definition Camera,1858 W. 17th St.,22500.0
25,2012,High Definition Camera,1758 W. Cermak,22500.0
25,2012,Miscellaneous Other,Plaza Tenochtitlan - CPAG,85000.0
25,2012,School Projects,Benito Juarez High School - public art,50000.0
26,2012,Alley Resurfacing,W POTOMAC AVE & W GRAND AVE & N LAWNDALE AVE &,21323.0
26,2012,Curb & Gutter,ON N MAPLEWOOD AVE FROM W DIVISION ST (1200 N) TO,6006.0
26,2012,Curb & Gutter,ON W LE MOYNE ST FROM N KEDZIE AV (3200 W) TO N,113943.0
26,2012,Curb & Gutter,ON W REFECTORY DR FROM W HUMBOLT DR TO W,78593.0
26,2012,"In-Road ""State Law Stop",N RIDGEWAY AVE & W ARMITAGE AVE,960.0
26,2012,"In-Road ""State Law Stop",N MONTICELLO AVE & W ARMITAGE AVE,800.0
26,2012,"In-Road ""State Law Stop",W ARMITAGE AVE & N LAWNDALE AVE,950.0
26,2012,"In-Road ""State Law Stop",N CALIFORNIA AVE & W CRYSTAL ST,410.0
26,2012,Miscellaneous Other,N KEDZIE AVE & W EVERGREEN AVE In-Road Signs,191.0
26,2012,Miscellaneous Other,ON N KEDZIE AVE FROM W NORTH AVE (1600 N) TO W,1200.0
26,2012,Miscellaneous Other,Division Street Gateways,45711.0
26,2012,Street Resurfacing,ON W HIRSCH ST FROM N MONTICELLO AV (3626 W) TO N,27060.0
26,2012,Street Resurfacing,ON N LEAVITT ST FROM W OHIO ST (600 N) TO W RACE AV,14584.0
26,2012,Street Resurfacing,ON W POTOMAC AVE FROM N HOMAN AV (3400 W) TO N,62545.0
26,2012,Street Resurfacing,ON N FRANCISCO AVE FROM W CORTEZ ST (1036 N) TO W,24876.0
26,2012,Street Speed Hump,ON N ALBANY AVE FROM W WABANSIA AV (1700 N) TO W,3700.0
26,2012,Street Speed Hump,ON W BEACH AVE FROM N HOMAN AV (3400 W) TO N ST,3700.0
26,2012,Street Speed Hump,ON N MONTICELLO AVE FROM W CORTLAND ST (1900 N) TO,3700.0
26,2012,Street Speed Hump,ON N MONTICELLO AVE FROM W LE MOYNE ST (1500 N) TO,3700.0
26,2012,Street Speed Hump,ON W POTOMAC AVE FROM N ROCKWELL ST (2600 W) TO N,3700.0
26,2012,Left-Turn Arrow,W GRAND AVE & W DIVISION ST,70000.0
26,2012,Left-Turn Arrow,N CENTRAL PARK & W DIVISION ST,70000.0
26,2012,Left-Turn Arrow,W NORTH AVE & N HOMAN BLVD,70000.0
26,2012,Street Light Residential,ON ROCKWELL FROM W DIVISION ST (1200 N) TO W NORTH,256000.0
26,2012,Street Light Residential,ON EVERGREEN FROM N ROCKWELL ST (2600 W) TO N,128000.0
26,2012,Street Light Residential,ON MOZART FROM W AUGUSTA BV (1000 N) TO W,128000.0
26,2012,Street Light Upgrade,3756 W CORTLAND ST,350.0
26,2012,Street Light Upgrade,ON EVERGREEN FROM N ROCKWELL ST (2600 W) TO N,2100.0
26,2012,Street Light Upgrade,3506 W WABANSIA AVE,350.0
26,2012,Street Light Upgrade,ON MONTICELLO FROM W POTOMAC AV (1300 N) TO W,1750.0
26,2012,Street Light Upgrade,ON KIMBALL FROM W WABANSIA AV (1700 N) TO W,3200.0
26,2012,Chicago Park District,Humboldt Park - concrete slabs for food trucks,150000.0
26,2012,High Definition Camera,Northwest corner of Kedzie and Evergreen,22500.0
27,2012,Alley Speed Hump,N CARPENTER ST & W HURON ST&N MILWAUKEE AVE & N,700.0
27,2012,Alley Speed Hump,N ST LOUIS AVE & N DRAKE AVE & W THOMAS ST & W,700.0
27,2012,Concrete Alley,N ABERDEEN ST & N CARPENTER ST & W CARROLL AVE &,150000.0
27,2012,Concrete Alley,N SANGAMON ST & DEAD END & W WASHINGTON BLVD &,78000.0
27,2012,Concrete Alley,W THOMAS ST & W CORTEZ ST & N MILWAUKEE AVE & N,291000.0
27,2012,Sidewalk,ON W CHICAGO AVE FROM N WELLS ST (200 W) TO N,18807.0
27,2012,Sidewalk,ON N CARPENTER ST FROM N MILWAUKEE AV (742 N) TO W,66407.0
27,2012,Sidewalk,ON N ALBANY AVE FROM W FULTON BV (300 N) TO W,22605.0
27,2012,Sidewalk,ON W THOMAS ST FROM N ST LOUIS AV (3500 W) TO N,18226.0
27,2012,Sidewalk,ON W HARRISON ST FROM S SACRAMENTO BLVD (3000 W),1590.0
27,2012,Street Resurfacing,ON N HAMLIN AVE FROM W THOMAS ST (1100 N) TO W,53802.0
27,2012,Street Resurfacing,ON W INSTITUTE PL FROM N FRANKLIN ST (300 W) TO N,44143.0
27,2012,Street Speed Hump,ON N MONTICELLO AVE FROM W THOMAS ST (1100 N) TO,3700.0
27,2012,Street Speed Hump,ON N LAWNDALE AVE FROM W OHIO ST (600 N) TO W,3700.0
27,2012,Street Light Arterial,N SPRINGFIELD AVE & W POTOMAC AVE,3500.0
27,2012,Street Light Pole Painting,ON MADISON FROM S ASHLAND AV (1600 W) TO S,1624.0
27,2012,Street Light Residential,ON HAMLIN FROM W FERDINAND ST (500 N) TO W OHIO ST,64000.0
27,2012,Street Light Residential,ON MONTICELLO FROM W OHIO ST (600 N) TO W HURON ST,72000.0
27,2012,Street Light Residential,ON FULTON FROM N SACRAMENTO BV (3000 W) TO N,128000.0
27,2012,Street Light Residential,ON HOMAN FROM W OHIO ST (600 N) TO W HURON ST (700,128000.0
27,2012,Street Light Residential,ON CENTRAL PARK FROM W AUGUSTA BV (1000 N) TO W,144000.0
27,2012,Street Light Upgrade,2824 W WALNUT ST,350.0
27,2012,Street Light Upgrade,ON N RIDGEWAY AVE FROM W OHIO ST (600 N) TO W,1750.0
27,2012,Street Light Upgrade,ON N HAMLIN AVE FROM W OHIO ST (600 N) TO W,2000.0
27,2012,Street Light Upgrade,ON MADISON FROM S ASHLAND AV (1600 W) TO S,10000.0
27,2012,Traffic Equipment,ON MADISON FROM S ASHLAND AV (1600 W) TO S,10600.0
28,2012,Alley Apron,ON S KILBOURN AVE FROM S TO W WILCOX ST (120 S),11220.0
28,2012,Alley Apron,ON S KILDARE AVE FROM 310 S TO W JACKSON BLVD (300,13527.0
28,2012,Alley Apron,ON S SPRINGFIELD AVE FROM 140 S TO W WILCOX ST (130,9035.0
28,2012,Alley Resurfacing,N HAMLIN BLVD & N HARDING AVE & W MAYPOLE AVE &,80650.0
28,2012,Alley Resurfacing,W WEST END AVE & W WASHINGTON BLVD & N KOSTNER,2862.0
28,2012,Alley Resurfacing,N HAMLIN BLVD & N PULASKI RD & W WEST END AVE & W,80674.0
28,2012,Alley Resurfacing,W JACKSON BLVD & W VAN BUREN ST & S CHRISTIANA,9678.0
28,2012,Alley Resurfacing,N HAMLIN BLVD & N PULASKI RD & W WEST END AVE & W,42836.0
28,2012,Curb & Gutter,ON W WILCOX ST FROM S KILDARE AV (4300 W) TO S,117224.0
28,2012,Curb & Gutter,ON W WASHINGTON BLVD FROM N LOCKWOOD AV (5300,89628.0
28,2012,Curb & Gutter,ON S ALBANY AVE FROM W POLK ST (810 S) TO W,31782.0
28,2012,Curb & Gutter,ON W JACKSON BLVD FROM S KILPATRICK AV (4700 W) TO,40303.0
28,2012,Curb & Gutter,ON S ALBANY AVE FROM W ROOSEVELT RD (1200 S) TO W,53460.0
28,2012,Sidewalk,ON W RACE AVE FROM N CICERO AVE (4800 W) TO N,566.0
28,2012,Sidewalk,ON W RACE AVE FROM N KILPATRICK AV (4700 W) TO N,1432.0
28,2012,Sidewalk,ON W LEXINGTON ST FROM S SACRAMENTO BV (3000 W),585.0
28,2012,Street Resurfacing,ON S CLAREMONT AVE FROM W POLK ST (800 S) TO W,66042.0
28,2012,Street Resurfacing,ON W MAYPOLE AVE FROM N CICERO AV (4800 W) TO N,66311.0
28,2012,Street Resurfacing,ON W QUINCY ST FROM S LARAMIE AV (5200 W) TO S,45210.0
28,2012,Street Resurfacing,ON W WILCOX ST FROM S KOSTNER AV (4400 W) TO S,70386.0
28,2012,Street Resurfacing,ON N LOREL AVE FROM W MADISON ST (0 N) TO W,56383.0
28,2012,Street Resurfacing,ON N LONG AVE FROM W WEST END AV (152 N) TO W,51841.0
28,2012,Street Resurfacing,ON N KILBOURN AVE FROM W MAYPOLE AV (200 N) TO W,25177.0
28,2012,Street Resurfacing,ON N CENTRAL PARK AVE FROM W LAKE ST (220 N) TO W,55897.0
28,2012,Street Resurfacing,ON N LECLAIRE AVE FROM W KINZIE ST (410 N) TO W,38477.0
28,2012,Street Resurfacing,ON W ADAMS ST FROM S PULASKI RD (4000 W) TO S,212110.0
28,2012,Street Speed Hump,ON W HURON ST FROM N KILPATRICK AV (4700 W) TO N,3700.0
28,2012,Street Speed Hump,ON N LEAMINGTON AVE FROM W WEST END AVE (150 N),3700.0
28,2012,Floodlight,ON KENTON FROM W MADISON ST (0 N) TO W WEST END,2000.0
28,2012,Floodlight,N LA CROSSE AVE & W MAYPOLE AVE,1000.0
28,2012,Floodlight,ON KENTON FROM W MADISON ST (0 N) TO W JACKSON BV,2000.0
28,2012,Floodlight,ON KENTON FROM W MONROE ST (100 S) TO W WILCOX ST,1500.0
28,2012,Street Light Pole Painting,ON CONGRESS FROM S HAMLIN BV (3752 W) TO S PULASKI,3600.0
28,2012,Street Light Upgrade,ON MOZART FROM W FILLMORE ST (1028 S) TO W,1400.0
28,2012,Street Light Upgrade,ON FILLMORE FROM S CALIFORNIA AV (2800 W) TO S,2450.0
28,2012,Street Light Upgrade,ON FRANCISCO FROM W FILLMORE ST (1028 S) TO W,1400.0
28,2012,Street Light Upgrade,ON KENTON FROM W MADISON ST (0 N) TO W WEST END,350.0
28,2012,Street Light Upgrade,259 N PULASKI RD,3850.0
28,2012,Street Light Upgrade,ON CONGRESS FROM S HAMLIN BV (3752 W) TO S PULASKI,4800.0
28,2012,Street Light Upgrade,ON WILCOX FROM S KEELER AV (4200 W) TO S KOSTNER,2450.0
28,2012,Street Light Upgrade,ON CALIFORNIA FROM W FILLMORE ST (1028 S) TO W,2000.0
28,2012,Street Light Upgrade,4549 W WEST END AVE,350.0
28,2012,Street Light Upgrade,3858 W MADISON ST,350.0
28,2012,Street Light Upgrade,3844 W MADISON ST,350.0
28,2012,Street Light Upgrade,4530 W WILCOX ST,350.0
28,2012,High Definition Camera,Relocate POD camera from Kostner & Monroe to Kostner & Wilcox,1800.0
28,2012,High Definition Camera,Relocate POD camera from 3502 W. Carroll to Walnut & St. Louis,1800.0
28,2012,High Definition Camera,Relocate POD camera from 2710 W. Harrison to 3000 W. Harrison,1800.0
28,2012,High Definition Camera,Relocate POD camera from 4701 W. Superior to Van Buren &,1800.0
28,2012,High Definition Camera,Relocate POD camera from 3902 W. Gladys to 3858 W. Jackson,1800.0
29,2012,Alley Resurfacing,S PARKSIDE AVE & S WALLER AVE & W MADISON ST & W,73706.0
29,2012,Alley Resurfacing,S MAYFIELD AVE & S MENARD AVE & W MADISON ST & W,69652.0
29,2012,Alley Resurfacing,S MAYFIELD AVE & S MASON AVE & W FILLMORE ST & W,48031.0
29,2012,Alley Resurfacing,N MAYFIELD AVE & N MASON AVE & W AUGUSTA BLVD &,54775.0
29,2012,Alley Resurfacing,S CENTRAL AVE & S LOTUS AVE & W ADAMS ST & W,63594.0
29,2012,Alley Resurfacing,N MONITOR AVE & N MENARD AVE & W LE MOYNE ST & W,33201.0
29,2012,Alley Speed Hump,N MASSASOIT AVE & W DIVISION ST & N MENARD AVE & W,1400.0
29,2012,Alley Speed Hump,W NORTH AVE & N NARRAGANSETT AVE & N MOBILE AVE,1400.0
29,2012,Curb & Gutter,ON WASHINGTON FROM N MAYFIELD AV (5850 W) TO N,16396.0
29,2012,Curb & Gutter,ON W WASHINGTON BLVD FROM N MAYFIELD AV (5850 W),52946.0
29,2012,Sidewalk,ON W ERIE ST FROM N MENARD AV (5800 W) TO N,1761.0
29,2012,Sidewalk,ON N AUSTIN BLVD FROM W HIRSCH ST (1400 N) TO W LE,33730.0
29,2012,Sidewalk,ON W ERIE ST FROM N MAYFIELD AV (5850 W) TO N,451.0
29,2012,Street Resurfacing,ON W THOMAS ST FROM N MASON AV (5932 W) TO N,18660.0
29,2012,Street Resurfacing,ON W BLOOMINGDALE AVE FROM N MEADE AV (6100 W),46052.0
29,2012,Street Resurfacing,ON W HURON ST FROM N PARKSIDE AV (5632 W) TO N,34296.0
29,2012,Street Resurfacing,ON S MASON AVE FROM W MADISON ST (0 N) TO W ADAMS,59595.0
29,2012,Street Resurfacing,ON W POTOMAC AVE FROM N WALLER AV (5700 W) TO N,17220.0
29,2012,Street Resurfacing,ON W BLOOMINGDALE AVE FROM N AUSTIN AV (6000 W),27116.0
29,2012,Street Resurfacing,ON W POTOMAC AVE FROM N PARKSIDE AV (5632 W) TO N,17313.0
29,2012,Street Resurfacing,ON W IOWA ST FROM N CENTRAL AV (5600 W) TO N,34225.0
29,2012,Street Resurfacing,ON W BLOOMINGDALE AVE FROM N MCVICKER AV (6032,26185.0
29,2012,Street Resurfacing,ON N MELVINA AVE FROM W WRIGHTWOOD AV (2600 N) TO,39373.0
29,2012,Street Resurfacing,ON N MAYFIELD AVE FROM W AUGUSTA BV (1000 N) TO W,75969.0
29,2012,Street Resurfacing,ON S LEAMINGTON AVE FROM W VAN BUREN ST (420 S) TO,19549.0
29,2012,Street Speed Hump,ON N MASSASOIT AVE FROM W IOWA ST (900 N) TO W,3700.0
29,2012,Street Light Residential,ON PARKSIDE FROM W CHICAGO AV (800 N) TO W HURON,96000.0
29,2012,Street Light Residential,ON MASSASOIT FROM W AUGUSTA BV (1000 N) TO W,128000.0
29,2012,Street Light Residential,ON MENARD FROM W AUGUSTA BV (1000 N) TO W,128000.0
29,2012,Street Light Residential,ON WALLER FROM W CHICAGO AV (800 N) TO W HURON ST,96000.0
29,2012,Street Light Upgrade,1639 N NARRAGANSETT AVE,350.0
30,2012,Alley Apron,ON W ROSCOE ST FROM 4141 W TO N KEDVALE AV (4127 W),9017.0
30,2012,Alley Apron,ON W GEORGE ST FROM 3614 W TO N CENTRAL PARK AV,9722.0
30,2012,Alley Apron,ON N LOWELL AVE FROM 3416 N TO W ROSCOE ST (3400 N),9256.0
30,2012,Alley Apron,ON W ADDISON ST FROM 4116 W TO N KEDVALE AV (4120,9608.0
30,2012,Alley Resurfacing,N PULASKI RD & N SPRINGFIELD AVE & W ADDISON ST & W,43970.0
30,2012,Alley Resurfacing,N KILDARE AVE & N KEELER AVE & W SCHOOL ST & W,17906.0
30,2012,Alley Resurfacing,N KEELER AVE & N TRIPP AVE & W NORTH AVE & W,48043.0
30,2012,Alley Resurfacing,N KARLOV AVE & N KEDVALE AVE & W BLOOMINGDALE,3029.0
30,2012,Alley Resurfacing,N KEELER AVE & N TRIPP AVE & W BLOOMINGDALE AVE &,49837.0
30,2012,Alley Resurfacing,N KEYSTONE AVE & N PULASKI RD & W ARMITAGE AVE &,45276.0
30,2012,Alley Resurfacing,N HARDING AVE & N PULASKI RD & W CORTLAND ST & W,27256.0
30,2012,Alley Resurfacing,N CICERO AVE & N KEATING AVE & W ADDISON ST & W,25926.0
30,2012,Alley Speed Hump,N LUNA AVE & N LINDER AVE & W BELMONT AVE & W,700.0
30,2012,Alley Speed Hump,N KENTON AVE & N KOLMAR AVE & W ROSCOE ST & W,1400.0
30,2012,Alley Speed Hump,N KEELER AVE & N TRIPP AVE & W PALMER & W DICKENS,700.0
30,2012,Curb & Gutter,ON W BARRY AVE FROM N MONITOR AV (5832 W) TO N,11573.0
30,2012,Curb & Gutter,ON W CORNELIA AVE FROM N LOWELL AV (4332 W) TO N,11386.0
30,2012,Curb & Gutter,ON N MENARD AVE FROM W WELLINGTON AV (3000 N) TO,2642.0
30,2012,Curb & Gutter,ON N AVERS AVE FROM W GRAND AV (1316 N) TO W,2996.0
30,2012,Curb & Gutter,ON N LAWNDALE AVE FROM W SCHOOL ST (3300 N) TO W,17534.0
30,2012,"In-Road ""State Law Stop",N MILWAUKEE AVE & N SPRINGFIELD AVE,550.0
30,2012,"In-Road ""State Law Stop",N MILWAUKEE AVE & N LAWNDALE AVE,550.0
30,2012,Miscellaneous Other,N CICERO AVE & W CORNELIA AVE pavement markings,314.0
30,2012,Pedestrian Refuge Island,N MILWAUKEE AVE & N SPRINGFIELD AVE,22062.0
30,2012,Sidewalk,ON W GEORGE ST FROM N HARDING AV (3932 W) TO N,3958.0
30,2012,Sidewalk,ON W ROSCOE ST FROM N LOWELL AV (4332 W) TO N,2251.0
30,2012,Sidewalk,ON N KILPATRICK AVE FROM W ROSCOE ST (3400 N) TO W,1220.0
30,2012,Sidewalk,ON MONITOR FROM W WELLINGTON AV (3000 N) TO W,10350.0
30,2012,Sidewalk,ON N KILBOURN AVE FROM W CORNELIA AV (3500 N) TO W,14109.0
30,2012,Sidewalk,ON N DAVLIN CT FROM W BARRY AV (3070 N) TO N,78534.0
30,2012,Sidewalk,ON W WELLINGTON AVE FROM N HAMLIN AV (3760 W) TO,8644.0
30,2012,Sidewalk,ON N MONITOR AVE FROM W SCHUBERT AV (2700 N) TO W,1372.0
30,2012,Sidewalk,ON N RIDGEWAY AVE FROM N MILWAUKEE AV (3077 N) TO,30165.0
30,2012,Sidewalk,ON N MASON AVE FROM W GEORGE ST (2900 N) TO W,86833.0
30,2012,Sidewalk,ON N PULASKI RD FROM W DICKENS AV (2100 N) TO W,14915.0
30,2012,Sidewalk,ON MANGO FROM W BARRY AV (3100 N) TO W BELMONT,28765.0
30,2012,Sidewalk,ON N TRIPP AVE FROM W ROSCOE ST (3400 N) TO N,88611.0
30,2012,Sidewalk,ON N MARMORA AVE FROM W SCHUBERT AVE (2700 N) TO,3375.0
30,2012,Sidewalk,ON N PARKSIDE AVE FROM W SCHUBERT AV (2700 N) TO W,1603.0
30,2012,Street Resurfacing,ON W WELLINGTON AVE FROM N MANGO AV (5732 W) TO N,49306.0
30,2012,Street Resurfacing,ON N KILPATRICK AVE FROM W SCHOOL ST (3300 N) TO W,47931.0
30,2012,Street Resurfacing,ON N MANGO AVE FROM W WELLINGTON AV (3000 N) TO W,51789.0
30,2012,Street Resurfacing,ON W BARRY AVE FROM N MENARD AV (5800 W) TO N,18966.0
30,2012,Street Resurfacing,ON N RIDGEWAY AVE FROM W SCHOOL ST (3300 N) TO W,108366.0
30,2012,Street Resurfacing,ON N LINDER AVE FROM W BARRY AV (3100 N) TO W,37015.0
30,2012,Street Resurfacing,ON W GEORGE ST FROM N CENTRAL PARK AV (3600 W) TO,38266.0
30,2012,Street Resurfacing,ON W SCHUBERT AVE FROM N CENTRAL AV (5600 W) TO N,180901.0
30,2012,Street Speed Hump,ON N KARLOV AVE FROM W SCHOOL ST (3300 N) TO N,3700.0
30,2012,Street Speed Hump,ON W ROSCOE ST FROM N LAWNDALE AVE (3700 W) TO N,1850.0
30,2012,Street Speed Hump,ON W ROSCOE ST FROM N KILPATRICK AV (4648 W) TO N,1850.0
30,2012,Street Speed Hump,ON N MAJOR AVE FROM W FULLERTON AV (2400 N) TO W,3700.0
30,2012,Street Light Arterial,N SPRINGFIELD AVE & W HIRSCH ST INSTALL POLE FOR CAMERA,5000.0
30,2012,Street Light Upgrade,5511 W DIVERSEY AVE,350.0
30,2012,Street Light Upgrade,5934 W DIVERSEY AVE,350.0
30,2012,Street Light Upgrade,3925 W EDDY ST,350.0
30,2012,Street Light Upgrade,5503 W DIVERSEY AVE,350.0
30,2012,Street Light Upgrade,5531 W DIVERSEY AVE,350.0
30,2012,Street Light Upgrade,ON NEWPORT FROM N PULASKI RD (4000 W) TO N KARLOV,1050.0
30,2012,High Definition Camera,Springfield & Hirsch,22500.0
31,2012,Alley Apron,ON W FLETCHER ST FROM 4114 W TO N KARLOV AV (4100,8961.0
31,2012,Alley Resurfacing,W DIVERSEY AVE & W GEORGE ST & N KILBOURN AVE & N,43886.0
31,2012,Alley Resurfacing,W DIVERSEY PKWY & W PARKER AVE & N CICERO AVE & N,53266.0
31,2012,Alley Resurfacing,N CICERO AVE & N LAMON AVE & W PARKER AVE & W,31650.0
31,2012,Street Resurfacing,ON N LONG AVE FROM W GEORGE ST (2900 N) TO W,79623.0
31,2012,Street Resurfacing,ON W BARRY AVE FROM N LINDER AV (5500 W) TO N,15025.0
31,2012,Street Resurfacing,ON W ALTGELD ST FROM N LAVERGNE AV (5000 W) TO N,53445.0
31,2012,Street Resurfacing,ON N LINDER AVE FROM W WELLINGTON AV (3000 N) TO W,53879.0
31,2012,Street Resurfacing,ON W NELSON ST FROM N PULASKI RD (4000 W) TO N,48589.0
31,2012,Street Resurfacing,ON W GEORGE ST FROM N LAVERGNE AV (5000 W) TO N,61461.0
31,2012,Street Resurfacing,ON N LINDER AVE FROM W GEORGE ST (2900 N) TO W,37525.0
31,2012,Street Resurfacing,ON N TRIPP AVE FROM W DIVERSEY AV (2800 N) TO W,54655.0
31,2012,Street Resurfacing,ON W PARKER AVE FROM N KILPATRICK AV (4700 W) TO N,51824.0
31,2012,Street Resurfacing,ON W ALTGELD ST FROM N KILPATRICK AV (4700 W) TO N,52402.0
31,2012,Street Resurfacing,ON N LONG AVE FROM W WELLINGTON AV (3000 N) TO W,83559.0
31,2012,Street Resurfacing,ON N KOLMAR AVE FROM W GEORGE ST (2900 N) TO W,30373.0
31,2012,Street Resurfacing,ON W DEMING PL FROM N CICERO AV (4800 W) TO N,36285.0
31,2012,Street Resurfacing,ON W WRIGHTWOOD AVE FROM N KILBOURN AV (4500 W),40850.0
31,2012,Street Resurfacing,ON N PARKSIDE AVE FROM W GEORGE ST (2900 N) TO W,52213.0
31,2012,Street Resurfacing,ON N LUNA AVE FROM W GEORGE ST (2900 N) TO W,38635.0
31,2012,Street Resurfacing,ON N LONG AVE FROM W DIVERSEY AV (2800 N) TO W,36880.0
31,2012,Street Resurfacing,ON W OAKDALE AVE FROM N LAVERGNE AV (5000 W) TO N,40382.0
31,2012,Street Resurfacing,ON W WELLINGTON AVE FROM N LARAMIE AV (5200 W) TO,38080.0
31,2012,Street Speed Hump,ON N KILBOURN AVE FROM W CORTLAND ST (1900 N) TO W,3700.0
31,2012,Street Speed Hump,ON W PARKER AVE FROM N KILBOURN AV (4500 W) TO N,3700.0
31,2012,Street Speed Hump,ON W MEDILL AVE FROM N LECLAIRE AV (5100 W) TO N,3700.0
31,2012,Street Speed Hump,ON W ALTGELD ST FROM N LARAMIE AV (5200 W) TO N,3700.0
31,2012,Street Speed Hump,ON N LECLAIRE AVE FROM W PALMER ST (2200 N) TO W,3700.0
31,2012,Street Speed Hump,ON W ALTGELD ST FROM N LECLAIRE AV (5100 W) TO N,3700.0
31,2012,Floodlight,2000 N LAMON AVE,2000.0
31,2012,Floodlight,4877 W HOMER ST,500.0
31,2012,Street Light Residential,ON W MONTANA ST FROM N CICERO AV (4800 W) TO N,154000.0
31,2012,Street Light Residential,ON W ALTGELD ST FROM N CICERO AV (4800 W) TO N,79900.0
31,2012,Street Light Upgrade,4939 W GEORGE ST,350.0
31,2012,Street Light Upgrade,2711 N LAMON AVE,350.0
31,2012,High Definition Camera,"Wellington & Kilpatrick (TPC = $22,500) 2011 menu is $5,250",22500.0
32,2012,Alley Resurfacing,N MAUD AVE & N SHEFFIELD AVE & N CLYBOURN AVE & N,44500.0
32,2012,"In-Road ""State Law Stop",N LINCOLN AVE & W CORNELIA AVE,410.0
32,2012,"In-Road ""State Law Stop",N OAKLEY AVE & W ARMITAGE AVE,950.0
32,2012,"In-Road ""State Law Stop",N DAMEN AVE & W CORTLAND ST,950.0
32,2012,Pavement Markings,W NELSON ST & N DAMEN AVE,1200.0
32,2012,Street Bump Outs,ON W WEBSTER AVE FROM N DOMINICK ST (1533 W) TO N,43788.0
32,2012,Street Resurfacing,ON W FLETCHER ST FROM N HOYNE AV (2100 W) TO N,54783.0
32,2012,Street Resurfacing,ON W DICKENS AVE FROM N DAMEN AV (2000 W) TO N,49232.0
32,2012,Street Resurfacing,ON W CHARLESTON ST FROM N DAMEN AV (2000 W) TO N,52737.0
32,2012,Street Resurfacing,ON N MARSHFIELD AVE FROM W WRIGHTWOOD AV (2600,100262.0
32,2012,Street Resurfacing,ON N PAULINA ST FROM W CORTLAND ST (1900 N) TO W,40713.0
32,2012,Street Resurfacing,ON W SHAKESPEARE AVE FROM N HOYNE AV (2100 W) TO,37232.0
32,2012,Street Resurfacing,ON W HENDERSON ST FROM N WOLCOTT AV (1900 W) TO N,53062.0
32,2012,Street Resurfacing,ON N GREENVIEW AVE FROM W FULLERTON AV (2400 N),27832.0
32,2012,Street Resurfacing,ON W WINCHESTER AVE FROM W NORTH AV (1600 N) TO W,44337.0
32,2012,Street Resurfacing,ON W CHARLESTON ST FROM N HOYNE AV (2100 W) TO N,53781.0
32,2012,Street Resurfacing,ON N WOLCOTT AVE FROM W NORTH AV (1600 N) TO W,45720.0
32,2012,Street Resurfacing,ON W ROSCOE ST FROM N OAKLEY AV (2300 W) TO N,30911.0
32,2012,Street Resurfacing,ON W WRIGHTWOOD AVE FROM N PAULINA ST (1700 W) TO,33703.0
32,2012,Street Resurfacing,ON W MELROSE ST FROM N DAMEN AV (2000 W) TO N,51892.0
32,2012,Street Resurfacing,ON W LYNDALE ST FROM N LEAVITT ST (2200 W) TO N,29557.0
32,2012,Street Resurfacing,ON N BELL AVE FROM Dead End (7557 N) TO W PALMER ST,51052.0
32,2012,Street Resurfacing,ON N WOLCOTT AVE FROM W ARMITAGE AV (2000 N) TO W,53519.0
32,2012,Street Resurfacing,ON N HERMITAGE AVE FROM W WABANSIA AV (1650 N) TO,108966.0
32,2012,Street Resurfacing,ON N WOLCOTT AVE FROM W WABANSIA AV (1650 N) TO W,48534.0
32,2012,Street Resurfacing,ON N WILMOT AVE FROM N LEAVITT ST (1834 N) TO N,63195.0
32,2012,Street Resurfacing,ON N HOYNE AVE FROM W ROSCOE ST (3400 N) TO W,41157.0
32,2012,Street Resurfacing,ON W HOMER ST FROM N DAMEN AV (2000 W) TO N HOYNE,55181.0
32,2012,Street Resurfacing,ON W MOFFAT ST FROM N HOYNE AV (2100 W) TO N,37396.0
32,2012,Street Resurfacing,ON N WOOD ST FROM W NORTH AV (1600 N) TO W,49992.0
32,2012,Street Speed Hump,ON N HOYNE AVE FROM W SCHOOL ST (3300 N) TO W,3700.0
32,2012,Street Speed Hump,ON N OAKLEY AVE FROM W SHAKESPEARE AV (2140 N) TO,1850.0
32,2012,Street Speed Hump,ON W BARRY AVE FROM N ASHLAND AV (1600 W) TO N,3700.0
32,2012,Street Speed Hump,ON N HERMITAGE AVE FROM W GEORGE ST (2915 N) TO W,1850.0
32,2012,Street Speed Hump,ON N HOYNE AVE FROM W SCHOOL ST (3300 N) TO W,1850.0
33,2012,Alley Resurfacing,N CALIFORNIA AVE & N MOZART ST & W WELLINGTON,37959.0
33,2012,"In-Road ""State Law Stop",N FRANCISCO AVE & W MONTROSE AVE,800.0
33,2012,Miscellaneous Other,N WHIPPLE ST & W MONTROSE AVE In-Road signs,660.0
33,2012,Sidewalk,ON N ELSTON AVE FROM N TROY ST (3450 N) TO N TROY ST,11754.0
33,2012,Sidewalk,ON N TROY ST FROM N ELSTON AV (3526 N) TO W EDDY ST,11754.0
33,2012,Street Resurfacing,ON N SAWYER AVE FROM W LELAND AV (4700 N) TO W,28311.0
33,2012,Street Resurfacing,ON W BYRON ST FROM N FRANCISCO AV (2900 W) TO N,63273.0
33,2012,Street Resurfacing,ON N TROY ST FROM W ROSCOE ST (3400 N) TO N ELSTON,46685.0
33,2012,Street Resurfacing,ON W WINDSOR AVE FROM Dead End (2758 W) TO N MANOR,26447.0
33,2012,Street Resurfacing,ON N SACRAMENTO AVE FROM W BERTEAU AV (4200 N) TO,80920.0
33,2012,Street Light Arterial,N ALBANY AVE & W BYRON ST,3000.0
33,2012,Street Light Residential,ON SACRAMENTO FROM W IRVING PARK RD (4000 N) TO W,144000.0
33,2012,Street Light Residential,ON RICHMOND FROM W IRVING PARK RD (4000 N) TO W,144000.0
33,2012,Street Light Residential,ON FRANCISCO FROM W IRVING PARK RD (4000 N) TO W,144000.0
33,2012,Street Light Residential,ON WHIPPLE FROM W IRVING PARK RD (4000 N) TO W,144000.0
33,2012,Street Light Residential,ON ALBANY FROM W IRVING PARK RD (4000 N) TO W,144000.0
33,2012,Street Light Residential,ON MOZART FROM W IRVING PARK RD (4000 N) TO W,144000.0
33,2012,Street Light Residential,ON TROY FROM W IRVING PARK RD (4000 N) TO W,144000.0
33,2012,Street Light Upgrade,3758 N SACRAMENTO AVE,350.0
34,2012,Alley Apron,ON S PEORIA ST FROM 10457 S TO W 104 ST (10400 S),19115.0
34,2012,Alley Resurfacing,W 117TH ST & W 117TH PL & S LOWE AVE & S WALLACE ST,17623.0
34,2012,Alley Resurfacing,W 116TH ST & W 117TH ST & S GREEN ST & S HALSTED ST,32390.0
34,2012,Alley Resurfacing,117th St - 117th Pl - Lowe - Wallace,2762.0
34,2012,Alley Speed Hump,S JUSTINE ST & S ASHLAND AVE & W 121ST ST & W 122ND,1400.0
34,2012,Alley Speed Hump,S LAFLIN ST & S BISHOP ST & W 112TH PL & W 113TH ST,4200.0
34,2012,Alley Speed Hump,S JUSTINE ST & S ASHLAND AVE & W 120TH ST & W 121ST,2800.0
34,2012,Alley Speed Hump,S UNION AVE & S LOWE AVE & W 101ST ST & W 102ND ST,1400.0
34,2012,Bollard,ON S JUSTINE ST FROM 122 S TO W 122 ST (12200 S),10700.0
34,2012,Bus Pad,201 W 103rd St,2407.0
34,2012,Curb & Gutter,ON W 123RD ST FROM S LAFLIN ST (1500 W) TO S BISHOP ST,12556.0
34,2012,Curb & Gutter,ON S SANGAMON ST FROM W 112 ST (11200 S) TO Dead End,116141.0
34,2012,Curb & Gutter,ON S EMERALD AVE FROM W 104 ST (10400 S) TO W 106 ST,27579.0
34,2012,Curb & Gutter,ON S BEVERLY AVE FROM W 109 ST (10900 S) TO W 109 PL,13083.0
34,2012,Curb & Gutter,ON S GREEN ST FROM W 113 ST (11300 S) TO Dead End (11350,5220.0
34,2012,Curb & Gutter,ON W 118TH ST FROM S LA SALLE ST (140 W) TO S,10895.0
