ward,year,category,location,cost
18,2012,Street Resurfacing,ON S ROCKWELL ST FROM W 86 PL (8642 S) TO W 87 ST (8700,29079.0
18,2012,Street Resurfacing,ON S RICHMOND ST FROM W 81 ST (8100 S) TO W 82 ST (8200,37571.0
18,2012,Street Resurfacing,ON S ARTESIAN AVE FROM W 81 ST (8100 S) TO W 82 ST,39135.0
18,2012,Street Resurfacing,ON S MAPLEWOOD AVE FROM W 81 ST (8100 S) TO W 82 ST,40645.0
18,2012,Street Resurfacing,ON W 83RD PL FROM S WASHTENAW AV (2700 W) TO S,4680.0
18,2012,Street Resurfacing,ON S CAMPBELL AVE FROM W 80 ST (8000 S) TO W 81 ST,39038.0
18,2012,Street Speed Hump,ON W 85TH PL FROM S CENTRAL PARK AV (3600 W) TO S,3700.0
18,2012,Street Speed Hump,ON W 82ND ST FROM S DAMEN AV (2000 W) TO S HOYNE AV,3700.0
18,2012,Street Speed Hump,ON W 85TH ST FROM S CENTRAL PARK AV (3600 W) TO S,3700.0
18,2012,Street Speed Hump,ON W 85TH ST FROM S LAWNDALE AV (3700 W) TO S,3700.0
18,2012,Street Light Residential,ON CALIFORNIA FROM W 84 ST (8381 S) TO W 85 ST (8461 S),72000.0
18,2012,Street Light Residential,ON CALIFORNIA FROM W 83 ST (8300 S) TO W 84 ST (8381 S),72000.0
18,2012,Street Light Residential,ON ARTESIAN FROM W 71 ST (7100 S) TO W 73 ST (7300 S),94000.0
18,2012,Street Light Residential,ON CALIFORNIA FROM W 85 ST (8500 S) TO W 86 ST (8614 S),72000.0
18,2012,Street Light Residential,ON CALIFORNIA FROM W 86 ST (8614 S) TO W 87 ST (8700 S),72000.0
18,2012,Street Light Upgrade,8227 S ARTESIAN AVE,350.0
19,2012,Sidewalk,ON W 111TH ST FROM S LAWNDALE AV (3700 W) TO S,4335.0
19,2012,Street Resurfacing,ON W EDMAIRE ST FROM S HALE AV (2006 W) TO S,48882.0
19,2012,Street Resurfacing,ON S DAMEN AVE FROM W 90 ST (9000 S) TO W 91 ST (9100 S),57253.0
19,2012,Street Resurfacing,ON S LEAVITT ST FROM W 93 ST (9300 S) TO W 94 ST (9400 S),54391.0
19,2012,Street Resurfacing,ON S BELL AVE FROM W 101 ST (10100 S) TO W 102 ST (10200,42172.0
19,2012,Street Resurfacing,ON S WINCHESTER AVE FROM W 97 ST (9700 S) TO W 98 ST,58110.0
19,2012,Street Resurfacing,ON S AVERS AVE FROM W 103 ST (10300 S) TO Dead End,31017.0
19,2012,Street Resurfacing,ON W 93RD ST FROM S DAMEN AV (2010 W) TO S HAMILTON,82536.0
19,2012,Street Resurfacing,ON W 113TH PL FROM S BELL AV (2223 W) TO S OAKLEY AV,49436.0
19,2012,Street Resurfacing,ON S MAPLEWOOD AVE FROM W 116 ST (11600 S) TO W 117,84454.0
19,2012,Street Resurfacing,ON W 102ND PL FROM S PROSPECT AV (1560 W) TO S,52250.0
19,2012,Street Resurfacing,ON S BELL AVE FROM W 117 PL (11717 S) TO W 118 ST (11755,32535.0
19,2012,Street Resurfacing,ON S BELL AVE FROM W 102 ST (10200 S) TO W 103 ST (10300,39466.0
19,2012,Street Resurfacing,ON S CLAREMONT AVE FROM W 100 ST (10000 S) TO W 101,54654.0
19,2012,Street Resurfacing,ON S CHURCH ST FROM W 104 ST (10400 S) TO W 105 ST,50827.0
19,2012,Street Resurfacing,ON W 103RD ST FROM S TALMAN AV (2632 W) TO S TALMAN,26568.0
19,2012,Street Resurfacing,ON S WHIPPLE ST FROM W 107 ST (10700 S) TO W 108 ST,67046.0
19,2012,Street Resurfacing,ON S LONGWOOD DR FROM W 103 ST (10300 S) TO W 105 ST,92017.0
19,2012,Street Resurfacing,ON W MONTVALE AVE FROM S HERMOSA AV (1872 W) TO S,46567.0
19,2012,Street Resurfacing,ON W 101ST ST FROM S WOOD ST (1800 W) TO S WALDEN,18114.0
19,2012,Street Resurfacing,ON S CENTRAL PARK AVE FROM W 111 ST (11100 S) TO W,66758.0
19,2012,Street Resurfacing,ON S HOYNE AVE FROM W 96 ST (9600 S) TO W 98 ST (9800 S),71512.0
19,2012,Street Resurfacing,ON S LEAVITT ST FROM W 99 ST (9900 S) TO W 101 ST (10100,72748.0
19,2012,Street Resurfacing,ON S TROY ST FROM W 106 ST (10600 S) TO W 107 ST (10700,42676.0
19,2012,Street Resurfacing,ON W 110TH ST FROM S HOYNE AV (2107 W) TO S BELL AV,39555.0
19,2012,Street Speed Hump,ON W 115TH ST FROM S LONGWOOD DR (2111 W) TO S,3700.0
19,2012,Street Speed Hump,ON W 105TH ST FROM S TALMAN AVE (2650 W) TO S,1850.0
19,2012,Street Light Upgrade,2551 W 110TH PL,350.0
19,2012,Street Light Upgrade,10420 S LEAVITT ST,350.0
19,2012,Miscellaneous Other,Edna White Garden,20000.0
19,2012,Miscellaneous Other,Tree planting -2037 W. 108th Pl,515.0
20,2012,Alley Resurfacing,E 63RD ST & E 64TH ST & S UNIVERSITY AVE & S,28027.0
20,2012,Alley Speed Hump,S NORMAL AVE & S PARNELL AVE & W 64TH ST & W 65TH,1400.0
20,2012,Alley Speed Hump,S PEORIA ST & W 50TH PL&S MORGAN ST & W 51ST ST,1400.0
20,2012,Curb & Gutter,ON E 61ST ST FROM S ST LAWRENCE AV (600 E) TO S,8192.0
20,2012,Miscellaneous Other,ON 62 FROM S EBERHART AV (500 E) TO S CHAMPLAIN AV,193.0
20,2012,Sidewalk,ON S JUSTINE ST FROM W 49 ST (4900 S) TO W 50 ST (5000 S),53357.0
20,2012,Sidewalk,ON E 63RD ST FROM S UNIVERSITY AV (1138 E) TO S,51326.0
20,2012,Sidewalk,ON S WOODLAWN AVE FROM E 61 ST (6100 S) TO E 62 ST,40858.0
20,2012,Sidewalk,ON S LAFLIN ST FROM W 47 ST (4700 S) TO W 49 ST (4900 S),83232.0
20,2012,Sidewalk,ON S CALUMET AVE FROM E 59 ST (5900 S) TO E 60 ST (6000,67716.0
20,2012,Sidewalk,ON E 65TH ST FROM S WOODLAWN AV (1200 E) TO S,13734.0
20,2012,Sidewalk,ON E 68TH ST FROM S ST LAWRENCE AV (600 E) TO S ST,7855.0
20,2012,Sidewalk,ON CALUMET FROM E 58 ST (5800 S) TO E 59 ST (5900 S),5018.0
20,2012,Sidewalk,ON 63 FROM S UNIVERSITY AV (1122 E) TO S WOODLAWN,3978.0
20,2012,Sidewalk,ON LAFLIN FROM W 87 ST (8700 S) TO W 89 (S) ST(8908 S),3794.0
20,2012,Sidewalk,ON S NORMAL BLVD FROM W 60 ST (6000 S) TO W 61 ST,39458.0
20,2012,Sidewalk,ON E 65TH ST FROM S CHAMPLAIN AV (634 E) TO S ST,10877.0
20,2012,Sidewalk,ON S BLACKSTONE AVE FROM E 61 ST (6100 S) TO E 61 PL,7275.0
20,2012,Sidewalk,ON S WOODLAWN AVE FROM E 62 ST (6200 S) TO E 63 ST,57784.0
20,2012,Sidewalk,ON S HERMITAGE AVE FROM W 48 ST (4800 S) TO W 49 ST,19247.0
20,2012,Sidewalk,ON WOODLAWN FROM E 61 ST (6100 S) TO E 62 ST (6200 S),4240.0
20,2012,Sidewalk,ON S CALUMET AVE FROM E 58 ST (5800 S) TO E 59 ST (5900,62538.0
20,2012,Sidewalk,ON S RHODES AVE FROM E MARQUETTE RD (6600 S) TO E 67,31239.0
20,2012,Sidewalk,ON DORCHESTER FROM E 64 ST (6400 S) TO E 65 ST (6500 S),13065.0
20,2012,Street Resurfacing,ON S EBERHART AVE FROM E 60 ST (6000 S) TO E 61 ST (6100,36786.0
20,2012,Street Resurfacing,ON S LANGLEY AVE FROM E 62 ST (6200 S) TO E 63 ST (6300,49310.0
20,2012,Street Resurfacing,ON E 66TH ST FROM S WABASH AV (38 E) TO S INDIANA AV,50810.0
20,2012,Street Resurfacing,ON W 56TH ST FROM S HALSTED ST (800 W) TO S GREEN ST,37803.0
20,2012,Street Resurfacing,ON S RHODES AVE FROM E MARQUETTE RD (6600 S) TO E 67,54107.0
20,2012,Street Resurfacing,ON S PRAIRIE AVE FROM Dead End (6675 S) TO E,24464.0
20,2012,Street Resurfacing,ON W 61ST ST FROM S PRINCETON AV (300 W) TO S,47794.0
20,2012,Street Resurfacing,ON E 64TH ST FROM S KENWOOD AV (1320 E) TO S,49015.0
20,2012,Street Resurfacing,ON S SANGAMON ST FROM W 52 ST (5200 S) TO W 53 ST (5301,71666.0
20,2012,Street Resurfacing,ON S DORCHESTER AVE FROM E 64 ST (6400 S) TO E 65 ST,51920.0
20,2012,Street Resurfacing,ON E 65TH ST FROM DR. MARTIN LUTHER KING JR. DR (400,16190.0
20,2012,Street Resurfacing,ON W 57TH PL FROM S STATE ST (0 E) TO S PERRY AV (100,36652.0
20,2012,Street Resurfacing,ON S PERRY AVE FROM W 57 PL (5738 S) TO W 59 ST (5900 S),56424.0
20,2012,Street Speed Hump,ON S EVANS AVE FROM E 64 ST (6400 S) TO E 65 ST (6500 S),3700.0
20,2012,Street Speed Hump,ON W 65TH ST FROM S NORMAL BV (500 W) TO S PARNELL,1850.0
20,2012,Street Speed Hump,ON S MARSHFIELD AVE FROM W 47 ST (4700 S) TO W 48 ST,2844.0
20,2012,Street Speed Hump,ON E 62ND ST FROM DR. MARTIN LUTHER KING JR. DR (400,14800.0
20,2012,Street Speed Hump,ON S RHODES AVE FROM E 63 ST (6300 S) TO E 64 ST (6400 S),3700.0
20,2012,Street Speed Hump,ON E 66TH ST FROM S WABASH AV (38 E) TO S INDIANA AV,5550.0
20,2012,Street Speed Hump,ON W 53RD PL FROM S HALSTED ST (800 W) TO S PEORIA ST,3700.0
20,2012,Street Speed Hump,ON S BISHOP ST FROM W 47 ST (4700 S) TO W 49 ST (4900 S),7400.0
20,2012,Floodlight,5634 S MICHIGAN AVE,500.0
20,2012,Street Light Residential,ON KIMBARK FROM E 61 ST (6100 S) TO E MARQUETTE RD,12800.0
20,2012,Street Light Residential,ON DREXEL FROM E 65 ST (6500 S) TO E 67 ST (6700 S),44800.0
20,2012,Street Light Residential,ON KENWOOD FROM E 61 ST (6100 S) TO E 64 ST (6400 S),19200.0
21,2012,Alley Apron,ON W 96TH ST FROM 1254 W TO S THROOP ST (1300 W),13777.0
21,2012,Alley Resurfacing,S HALSTED ST & S GREEN ST & W 90TH ST & W 91ST ST,6774.0
21,2012,Alley Resurfacing,W 95TH PL & W 95TH ST & S RACINE AVE & N THROOP ST,26558.0
21,2012,Curb & Gutter,ON S EMERALD AVE FROM W 88 ST (8800 S) TO W 89 ST (8900,100155.0
21,2012,Curb & Gutter,ON W 86TH ST FROM S MORGAN ST (1000 W) TO S,2236.0
21,2012,Curb & Gutter,ON S UNION AVE FROM S VINCENNES AV (8552 S) TO W 86,18768.0
21,2012,Curb & Gutter,ON W 84TH ST FROM S JUSTINE ST (1522 W) TO S ASHLAND,9325.0
21,2012,Curb & Gutter,ON S YALE AVE FROM W 98 ST (9800 S) TO Dead End (8150 S),19486.0
21,2012,Curb & Gutter,ON S THROOP ST FROM W 96 ST (9604 S) TO W 95 ST (9500 S),53405.0
21,2012,Sidewalk,ON S BISHOP ST FROM W 85 ST (8500 S) TO W 86 ST (8600 S),2559.0
21,2012,Sidewalk,ON W 86TH PL FROM S SUMMIT AV (832 W) TO S,41876.0
21,2012,Sidewalk,ON S THROOP ST FROM W 96 ST (9604 S) TO W 95 PL (9532 S),27007.0
21,2012,Sidewalk,ON W 95TH ST FROM S RACINE AV (1200 W) TO S RACINE AV,57400.0
21,2012,Sidewalk,ON W 93RD ST FROM S MAY ST (1132 W) TO S RACINE AV,34203.0
21,2012,Sidewalk,ON W 95TH ST FROM S ADA ST (1332 W) TO S THROOP ST,6758.0
21,2012,Sidewalk,ON S ABERDEEN ST FROM W 93 ST (9300 S) TO W 93 ST (9300,4028.0
21,2012,Sidewalk,ON W 86TH ST FROM S LOWE AV (632 W) TO S UNION AV,16294.0
21,2012,Sidewalk,ON S MAY ST FROM W 93 ST (9300 S) TO W 93 ST (9300 S),7141.0
21,2012,Sidewalk,ON S VINCENNES AVE FROM W 87 ST (8700 S) TO W 88 ST,20195.0
21,2012,Sidewalk,ON S WALLACE ST FROM W 91 ST (9100 S) TO W 91 ST (9100,3787.0
21,2012,Sidewalk,ON S MAY ST FROM W 94 ST (9400 S) TO W 95 ST (9500 S),76628.0
21,2012,Sidewalk,ON S NORMAL AVE FROM W 90 ST (9000 S) TO Dead End (9014,29406.0
21,2012,Sidewalk,ON S LOWE AVE FROM W 94 ST (9400 S) TO W 95 ST (9500 S),51263.0
21,2012,Street Resurfacing,ON S MAY ST FROM W 91 ST (9100 S) TO W 92 ST (9200 S),60848.0
21,2012,Street Resurfacing,ON W 91ST ST FROM S LAFLIN ST (1500 W) TO S JUSTINE ST,48106.0
21,2012,Street Resurfacing,ON W 94TH ST FROM S BISHOP ST (1432 W) TO S LOOMIS ST,18971.0
21,2012,Street Resurfacing,ON W 94TH ST FROM S LOWE AV (632 W) TO S EMERALD AV,69913.0
21,2012,Street Resurfacing,ON S MAY ST FROM W 94 ST (9400 S) TO W 95 ST (9500 S),53288.0
21,2012,Street Resurfacing,ON S PAULINA ST FROM W 91 ST (9100 S) TO W 92 ST (9200 S),88550.0
21,2012,Street Resurfacing,ON W 88TH ST FROM S HALSTED ST (800 W) TO S HALSTED,40029.0
21,2012,Street Resurfacing,ON S PEORIA ST FROM W 94 ST (9406 S) TO W 95 ST (9500 S),66327.0
21,2012,Street Resurfacing,ON W 84TH ST FROM S HALSTED ST (800 W) TO S GREEN ST,41704.0
21,2012,Street Resurfacing,ON W 91ST PL FROM S PAULINA ST (1700 W) TO S BEVERLY,17394.0
21,2012,Street Resurfacing,ON S LA SALLE ST FROM W 83 ST (8300 S) TO W 84 ST (8400,45815.0
21,2012,Street Resurfacing,ON W 97TH ST FROM S HALSTED ST (800 W) TO S,128927.0
21,2012,Street Speed Hump,ON S LOWE AVE FROM W 94 ST (9400 S) TO W 95 ST (9500 S),3700.0
21,2012,Street Speed Hump,ON W 95TH PL FROM S RACINE AV (1200 W) TO S THROOP ST,3700.0
21,2012,Street Speed Hump,ON W 88TH ST FROM S VINCENNES AV (907 W) TO S,3700.0
22,2012,Sidewalk,ON W 31ST ST FROM S KILDARE AV (4300 W) TO S KILDARE,43175.0
22,2012,Sidewalk,ON S RIDGEWAY AVE FROM W 25 ST (2500 S) TO W 26 ST,16074.0
22,2012,Sidewalk,ON S KILDARE AVE FROM W 25 PL (2532 S) TO W 26 ST (2600,7180.0
22,2012,Street Resurfacing,ON S CHRISTIANA AVE FROM W 23 ST (2300 S) TO W 24 ST,63091.0
22,2012,Street Resurfacing,ON S SPRINGFIELD AVE FROM W 28 ST (2800 S) TO W 31 ST,111620.0
22,2012,Street Resurfacing,ON S KOLIN AVE FROM W CERMAK RD (2200 S) TO W,16190.0
22,2012,Street Resurfacing,ON S AVERS AVE FROM W CERMAK RD (2200 S) TO Dead End,55543.0
22,2012,Street Resurfacing,ON W 33RD ST FROM S LAWNDALE AV (3700 W) TO S,64739.0
22,2012,Street Resurfacing,ON W 33RD ST FROM S KARLOV AV (4100 W) TO S KEELER,28380.0
22,2012,Street Speed Hump,ON S TRUMBULL AVE FROM W 24 ST (2400 S) TO W 25 ST,3700.0
22,2012,Street Speed Hump,ON S SPRINGFIELD AVE FROM W 26 ST (2600 S) TO W 27 ST,3700.0
22,2012,Street Speed Hump,ON S TRUMBULL AVE FROM W 28 ST (2800 S) TO W 31 ST,7400.0
22,2012,Street Speed Hump,ON S RIDGEWAY AVE FROM W 31 ST (3100 S) TO W 32 ST,3700.0
22,2012,Street Speed Hump,ON S KOLIN AVE FROM W CERMAK RD (2200 S) TO W,5550.0
22,2012,Street Speed Hump,ON S MILLARD AVE FROM W 28 ST (2800 S) TO W 32 ST (3200,11100.0
22,2012,Street Speed Hump,ON S CHRISTIANA AVE FROM W 23 ST (2300 S) TO W 24 ST,3700.0
22,2012,Street Speed Hump,ON S KILDARE AVE FROM W 26 ST (2600 S) TO W 30 ST (3000,11100.0
22,2012,Street Speed Hump,ON S SPRINGFIELD AVE FROM W 30 ST (3000 S) TO W 31 ST,3700.0
22,2012,Street Speed Hump,ON S RIDGEWAY AVE FROM W CERMAK RD (2200 S) TO W,18500.0
22,2012,Street Speed Hump,ON S HOMAN AVE FROM W 23 ST (2300 S) TO W 24 ST (2400,3700.0
22,2012,Street Speed Hump,ON S KEELER AVE FROM W 32 ST (3200 S) TO W 33 ST (3300,3700.0
22,2012,Street Speed Hump,ON S KOLIN AVE FROM W 31 ST (3100 S) TO W 32 ST (3200 S),3700.0
22,2012,Street Speed Hump,ON W 25TH PL FROM S KOLIN AV (4332 W) TO S KOSTNER,3700.0
22,2012,Street Speed Hump,ON S DRAKE AVE FROM W 23 ST (2300 S) TO W 26 ST (2600 S),11100.0
22,2012,Street Speed Hump,ON S SPRINGFIELD AVE FROM W 28 ST (2800 S) TO W 30 ST,3700.0
22,2012,Street Light Arterial,3200 S KOLIN AVE,3500.0
22,2012,Street Light Residential,ON 25 FROM S KEELER AV (4200 W) TO S KOSTNER AV (4400,72000.0
22,2012,Street Light Residential,ON 25 FROM S PULASKI RD (4000 W) TO S KARLOV AV (4038,72000.0
22,2012,Street Light Residential,ON 25 FROM S KEDVALE AV (4120 W) TO S KEELER AV (4200,72000.0
22,2012,Street Light Residential,ON 25 FROM S KARLOV AV (4038 W) TO S KEDVALE AV,72000.0
22,2012,Street Light Upgrade,3839 W 31ST ST,350.0
22,2012,Traffic New Signals,W 24TH ST & S PULASKI RD,350000.0
22,2012,Traffic Signal LED,W 31ST ST & S KEELER AVE,20000.0
22,2012,Miscellaneous Other,Site Acquisition for community garden - 4228 W. Ogden,150000.0
23,2012,Alley Apron,ON S SAYRE AVE FROM 6402 S TO W 64 PL (6432 S),10697.0
23,2012,Alley Speed Hump,W ARCHER AVE & W 54TH ST & S NASHVILLE AVE & S,1400.0
23,2012,Alley Speed Hump,W 62ND ST & W 63RD ST & S NEENAH AVE & S NATCHEZ,1400.0
23,2012,Concrete Alley,S KILBOURN AVE & S KENNETH AVE & W 53RD ST & DEAD,112000.0
23,2012,Curb & Gutter,ON S NEENAH AVE FROM W 54 ST (5400 S) TO W ARCHER AV,1789.0
23,2012,Curb & Gutter,6101 W 59th Street,13830.0
23,2012,Curb & Gutter,ON W 60TH ST FROM S NAGLE AV (6432 W) TO S NATCHEZ,5758.0
23,2012,Curb & Gutter,ON S MASON AVE FROM W 56 ST (5600 S) TO W 57 ST (5700 S),2280.0
23,2012,Curb & Gutter,ON S MCVICKER AVE FROM W 56 ST (5600 S) TO W 57 ST,766.0
23,2012,Curb & Gutter,ON W 59TH ST FROM S MOBILE AV (6300 W) TO S,7038.0
23,2012,Curb & Gutter,ON S NARRAGANSETT AVE FROM W 59 ST (5900 S) TO W 60,6263.0
23,2012,Curb & Gutter,ON S NASHVILLE AVE FROM W 51 ST (5100 S) TO W 52 ST,1371.0
23,2012,Curb & Gutter,ON S NATOMA AVE FROM W 57 ST (5700 S) TO W 58 ST (5800,3421.0
23,2012,Curb & Gutter,ON S AVERS AVE FROM W 52 ST (5200 S) TO W 53 ST (5300 S),6108.0
23,2012,Curb & Gutter,ON S MERRIMAC AVE FROM W 58 ST (5800 S) TO W 59 ST,2542.0
23,2012,Curb & Gutter,ON W 64TH ST FROM S NOTTINGHAM AV (7100 W) TO S,3090.0
23,2012,Curb & Gutter,ON S KILDARE AVE FROM W 51 ST (5100 S) TO W 52 ST (5200,3697.0
23,2012,Curb & Gutter,ON S NORMANDY AVE FROM W 64 PL (6432 S) TO W 64 ST,1943.0
23,2012,Curb & Gutter,ON S NAGLE AVE FROM W 56 ST (5600 S) TO W 57 ST (5700 S),1430.0
23,2012,Curb & Gutter,ON S MOBILE AVE FROM W 55 ST (5500 S) TO W 56 ST (5600,2500.0
23,2012,Curb & Gutter,ON S NARRAGANSETT AVE FROM W 53 ST (5300 S) TO W 54,902.0
23,2012,Curb & Gutter,ON W 59TH ST FROM S MEADE AV (6100 W) TO S MELVINA,18523.0
23,2012,Curb & Gutter,ON S MCVICKER AVE FROM W 51 ST (5100 S) TO W 52 ST,319.0
23,2012,Curb & Gutter,ON S MASON AVE FROM W 55 ST (5500 S) TO W 56 ST (5600 S),20090.0
23,2012,Curb & Gutter,5557 S Mason,13115.0
23,2012,Curb & Gutter,ON S NEWLAND AVE FROM W 53 ST (5300 S) TO W 54 ST,1330.0
23,2012,Curb & Gutter,ON S LAMON AVE FROM W 50 ST (5000 S) TO W 51 ST (5100 S),1680.0
23,2012,Curb & Gutter,ON S MULLIGAN AVE FROM W 60 ST (6000 S) TO W 61 ST,2155.0
23,2012,Curb & Gutter,ON S NEWLAND AVE FROM W 51 ST (5100 S) TO W 52 ST,1644.0
23,2012,Curb & Gutter,ON S MONITOR AVE FROM W 55 ST (5500 S) TO W 56 ST (5600,8357.0
23,2012,Curb & Gutter,ON S AUSTIN AVE FROM W 58 ST (5800 S) TO W 59 ST (5900 S),1403.0
23,2012,Curb & Gutter,ON S MENARD AVE FROM W 55 ST (5500 S) TO W 56 ST (5600,2651.0
23,2012,Curb & Gutter,5314 S Narragansett,2261.0
23,2012,Miscellaneous Other,ON S HAMLIN AVE FROM 5200 S TO W 52ND ST (5200 S),8155.0
23,2012,Miscellaneous Other,5807 W 55th,2770.0
23,2012,Sidewalk,ON S NASHVILLE AVE FROM W 52 ST (5200 S) TO W 53 ST,3371.0
23,2012,Sidewalk,ON S NARRAGANSETT AVE FROM W 51 ST (5100 S) TO W 52,2069.0
23,2012,Sidewalk,ON S LUNA AVE FROM W 52 ST (5200 S) TO S ARCHER AV,1559.0
23,2012,Sidewalk,ON S MCVICKER AVE FROM W 60 ST (6000 S) TO W 61 ST,12289.0
23,2012,Sidewalk,ON S MOBILE AVE FROM W 52 ST (5200 S) TO W 53 ST (5300,2370.0
23,2012,Sidewalk,ON 55 FROM S KENNETH AV (4432 W) TO S KILBOURN AV,11454.0
23,2012,Sidewalk,ON W 64TH ST FROM S NASHVILLE AV (6600 W) TO S,8188.0
23,2012,Sidewalk,ON S LARAMIE AVE FROM W 48 ST (4800 S) TO W 49 ST (4900,2222.0
23,2012,Sidewalk,ON W 55TH ST FROM S KOSTNER AV (4400 W) TO S,14803.0
23,2012,Sidewalk,ON S MOBILE AVE FROM W 58 ST (5800 S) TO W 59 ST (5900,2194.0
23,2012,Sidewalk,ON S MELVINA AVE FROM W 53 ST (5300 S) TO W 54 ST (5400,20403.0
23,2012,Sidewalk,ON S MENARD AVE FROM W 51 ST (5100 S) TO W 52 ST (5200,1311.0
23,2012,Sidewalk,ON S MASON AVE FROM W 52 ST (5200 S) TO W 53 ST (5300 S),2173.0
23,2012,Sidewalk,ON S MELVINA AVE FROM W 57 ST (5700 S) TO W 58 ST (5800,7486.0
23,2012,Sidewalk,ON S MENARD AVE FROM W 52 ST (5200 S) TO W 53 ST (5300,937.0
23,2012,Sidewalk,Sidewalk & C&G change orders various locations,100000.0
23,2012,Sidewalk,ON W 63RD PL FROM S NARRAGANSETT AV (6400 W) TO S,597.0
23,2012,Sidewalk,ON S NARRAGANSETT AVE FROM W 53 ST (5300 S) TO W 54,2165.0
23,2012,Sidewalk,ON S MONITOR AVE FROM W 55 ST (5500 S) TO W 56 ST (5600,2103.0
23,2012,Sidewalk,ON S NATCHEZ AVE FROM W 51 ST (5100 S) TO W 52 ST (5200,4204.0
23,2012,Sidewalk,ON S MULLIGAN AVE FROM W 55 ST (5500 S) TO W 56 ST,14763.0
23,2012,Sidewalk,ON S KEATING AVE FROM W 49 ST (4900 S) TO W 50 ST (5000,679.0
23,2012,Sidewalk,ON S NASHVILLE AVE FROM W 61 ST (6100 S) TO W 62 ST,12954.0
23,2012,Sidewalk,ON S AUSTIN AVE FROM W 60 ST (6000 S) TO W 61 ST (6100 S),1930.0
23,2012,Sidewalk,ON S MEADE AVE FROM W 58 ST (5800 S) TO W 59 ST (5900 S),2027.0
23,2012,Sidewalk,ON S NEW ENGLAND AVE FROM W ARCHER AV (5500 S) TO,1928.0
23,2012,Sidewalk,ON S MELVINA AVE FROM W 58 ST (5800 S) TO W 59 ST (5900,273.0
23,2012,Sidewalk,ON S KOLIN AVE FROM W 50 ST (5000 S) TO S ARCHER AV,15250.0
23,2012,Sidewalk,ON W 53RD ST FROM S NOTTINGHAM AV (7100 W) TO S,309.0
23,2012,Sidewalk,ON S MERRIMAC AVE FROM W 51 ST (5100 S) TO W 52 ST,1456.0
23,2012,Sidewalk,ON S RUTHERFORD AVE FROM W 58 ST (5800 S) TO W 59 ST,7424.0
23,2012,Sidewalk,ON S MOODY AVE FROM W 62 ST (6200 S) TO W 63 ST (6300,2514.0
23,2012,Sidewalk,ON S MERRIMAC AVE FROM W 54 ST (5400 S) TO W 55 ST,9469.0
23,2012,Sidewalk,ON S KILPATRICK AVE FROM W 47 ST (4700 S) TO W 48 ST,11653.0
23,2012,Sidewalk,ON S KEATING AVE FROM W 43 ST (4300 S) TO W 44 ST (4400,2129.0
23,2012,Sidewalk,ON S MCVICKER AVE FROM W 56 ST (5600 S) TO W 57 ST,848.0
23,2012,Sidewalk,ON S AUSTIN AVE FROM W 56 ST (5600 S) TO W 57 ST (5700 S),16359.0
23,2012,Sidewalk,ON S MEADE AVE FROM W 60 ST (6000 S) TO W 61 ST (6100 S),1872.0
23,2012,Sidewalk,ON W 63RD PL FROM S NATCHEZ AV (6500 W) TO S,2616.0
23,2012,Sidewalk,ON S LOTUS AVE FROM W 52 ST (5200 S) TO S ARCHER AV,2445.0
23,2012,Sidewalk,ON W 59TH ST FROM S MELVINA AV (6200 W) TO S MOBILE,24180.0
23,2012,Sidewalk,ON S MASON AVE FROM W 57 ST (5700 S) TO W 58 ST (5800 S),2143.0
23,2012,Sidewalk,ON S MAYFIELD AVE FROM W 58 ST (5800 S) TO W 59 ST,2100.0
23,2012,Sidewalk,ON S KILPATRICK AVE FROM W 44 ST (4400 S) TO W 45 ST,1989.0
23,2012,Sidewalk,ON S LAWNDALE AVE FROM W 51 ST (5100 S) TO W 52 ST,4745.0
23,2012,Sidewalk,ON S LONG AVE FROM W 54 ST (5400 S) TO W 55 ST (5500 S),723.0
23,2012,Street Bump Outs,ON S LUNA AVE FROM W 52 ST (5200 S) TO W 52 ST (5200 S),13581.0
23,2012,Street Resurfacing,ON S NEVA AVE FROM W ARCHER AV (5500 S) TO W 56 ST,49312.0
23,2012,Street Resurfacing,ON W 56TH ST FROM S PARKSIDE AV (5632 W) TO Dead End,27648.0
23,2012,Street Resurfacing,ON W 52ND ST FROM S CENTRAL AV (5600 W) TO S MAJOR,64370.0
23,2012,Street Resurfacing,ON S RUTHERFORD AVE FROM W ARCHER AV (5500 S) TO W,54232.0
23,2012,Street Resurfacing,ON S MENARD AVE FROM W 56 ST (5600 S) TO W 57 ST (5700,39587.0
23,2012,Street Resurfacing,ON S LAWNDALE AVE FROM W 51 ST (5100 S) TO W 55 ST,166167.0
23,2012,Street Speed Hump,ON S MAYFIELD AVE FROM W 56 ST (5600 S) TO W 57 ST,3700.0
23,2012,Street Speed Hump,ON S LARAMIE AVE FROM W 45 ST (4500 S) TO W 46 ST (4600,3700.0
23,2012,Street Speed Hump,ON S TRIPP AVE FROM W 50 ST (5000 S) TO W 51 ST (5100 S),1850.0
23,2012,Street Speed Hump,ON S RIDGEWAY AVE FROM W 51 ST (5100 S) TO W 52 ST,3700.0
23,2012,Street Speed Hump,ON S LATROBE AVE FROM W 51 ST (5100 S) TO W 52 ST (5200,3700.0
23,2012,Street Speed Hump,ON S KENNETH AVE FROM W 50 ST (5000 S) TO W 51 ST (5100,3700.0
23,2012,Street Speed Hump,ON S MCVICKER AVE FROM W 56 ST (5600 S) TO W 57 ST,3700.0
23,2012,Street Speed Hump,ON S LAWLER AVE FROM W 46 ST (4600 S) TO W 47 ST (4700,3700.0
23,2012,Floodlight,6843 W 60TH PL,1000.0
23,2012,Street Light Arterial,5558 S MENARD AVE,5000.0
23,2012,Chicago Park District,Archer Playground,150000.0
23,2012,Chicago Park District,Valley Forge,100000.0
24,2012,Alley Resurfacing,W 12TH PL & W 13TH PL & S ST LOUIS AVE & S CENTRAL,34823.0
24,2012,Bollard,3012 W 21ST PL,261.0
24,2012,Concrete Alley,"Gladys, Van Buren, Dead End, Kilpatrick",148082.0
24,2012,Curb & Gutter,ON S ST LOUIS AVE FROM W ROOSEVELT RD (1200 S) TO W,11303.0
24,2012,Curb & Gutter,ON S KOSTNER AVE FROM W 15 ST (1500 S) TO W 16 ST (1600,3133.0
24,2012,Curb & Gutter,ON W DOUGLAS BLVD FROM S KEDZIE AV (3200 W) TO S,87909.0
24,2012,Sidewalk,ON S HOMAN AVE FROM W 19 ST (1900 S) TO W 21 ST (2046,56800.0
24,2012,Sidewalk,ON W CERMAK RD FROM S KILDARE AV (4300 W) TO S,1763.0
24,2012,Sidewalk,ON S KARLOV AVE FROM W LEXINGTON ST (728 S) TO W,8826.0
24,2012,Sidewalk,ON W 21ST PL FROM S KILDARE AV (4300 W) TO S KOSTNER,6983.0
24,2012,Street Resurfacing,ON S CHRISTIANA AVE FROM W ROOSEVELT RD (1200 S) TO,51514.0
24,2012,Street Resurfacing,ON W CULLERTON ST FROM S KEELER AV (4200 W) TO S,60991.0
24,2012,Street Resurfacing,ON S KILDARE AVE FROM W CONGRESS PW (500 S) TO W,32339.0
24,2012,Street Resurfacing,ON S SPRINGFIELD AVE FROM W 16 ST (1600 S) TO W OGDEN,198590.0
24,2012,Street Resurfacing,ON S KILBOURN AVE FROM W JACKSON BV (300 S) TO W,68447.0
24,2012,Street Resurfacing,ON S KOLMAR AVE FROM W JACKSON BV (300 S) TO W,81885.0
24,2012,Street Resurfacing,ON S KEELER AVE FROM W 18 ST (1800 S) TO W CULLERTON,107013.0
24,2012,Street Resurfacing,ON W 13TH ST FROM S TROY ST (3132 W) TO S KEDZIE AV,19195.0
24,2012,Street Resurfacing,ON W GRENSHAW ST FROM S KARLOV AV (4100 W) TO S,40487.0
24,2012,Street Resurfacing,ON W 13TH ST FROM S KEDZIE AV (3200 W) TO S,41667.0
24,2012,Street Resurfacing,ON W 14TH ST FROM S KOSTNER AV (4400 W) TO S,40901.0
24,2012,Street Speed Hump,ON S RIDGEWAY AVE FROM W 18 ST (1800 S) TO W 19 ST,3700.0
24,2012,Street Speed Hump,ON S KILBOURN AVE FROM W JACKSON BV (300 S) TO W,3700.0
24,2012,Street Speed Hump,ON W FIFTH AVE FROM S KILDARE AV (4300 W) TO S,3700.0
24,2012,Street Speed Hump,ON S SPRINGFIELD AVE FROM W ROOSEVELT RD (1200 S),3700.0
24,2012,Street Speed Hump,ON W CULLERTON ST FROM S KEELER AV (4200 W) TO S,3700.0
24,2012,Street Speed Hump,ON W FIFTH AVE FROM S TRIPP AV (4231 W) TO S KILDARE,1850.0
24,2012,Street Speed Hump,ON S HAMLIN AVE FROM W 16 ST (1600 S) TO W 18 ST (1800,3700.0
24,2012,Street Speed Hump,ON W 13TH PL FROM S ST LOUIS AV (3500 W) TO S CENTRAL,3700.0
24,2012,Street Speed Hump,ON W POLK ST FROM S SPAULDING AV (3300 W) TO S,3700.0
24,2012,Street Speed Hump,ON S LAWNDALE AVE FROM W FLOURNOY ST (645 S) TO W,3700.0
24,2012,Street Speed Hump,ON S KOMENSKY AVE FROM W 16 ST (1600 S) TO W 18 ST,3700.0
24,2012,Street Speed Hump,ON S MILLARD AVE FROM W 15 ST (1500 S) TO W 16 ST (1600,3700.0
24,2012,Street Speed Hump,ON W ARTHINGTON ST FROM S ALBANY AV (3100 W) TO S,3700.0
24,2012,Street Speed Hump,ON S HARDING AVE FROM W ROOSEVELT RD (1200 S) TO W,7400.0
24,2012,Street Light Pole Painting,ON OGDEN FROM S CENTRAL PARK AV (3600 W) TO S,33500.0
24,2012,Street Light Residential,ON CULLERTON FROM S KEELER AV (4200 W) TO S,128000.0
24,2012,Street Light Upgrade,1240 S ST LOUIS AVE,350.0
24,2012,Street Light Upgrade,ON MILLARD FROM W 15 ST (1500 S) TO W 16 ST (1600 S),1050.0
24,2012,Miscellaneous Other,Tree installation - 4043 W. Harrison St.,539.0
25,2012,Concrete Alley,W 24TH ST & W COULTER ST & S LEAVITT ST & S LEAVITT,115000.0
25,2012,Concrete Alley,W 23RD ST & W 23RD PL & S HOYNE AVE & S LEAVITT ST,92000.0
25,2012,Concrete Alley,W 21ST ST & W 21ST PL & S HOYNE AVE & S LEAVITT ST,253000.0
25,2012,Concrete Alley,18th Pl/18th St/Hoyne/Leavitt,17691.0
25,2012,Concrete Alley,W 23RD ST & W CERMAK RD & S LEAVITT ST & S BELL AVE,79000.0
25,2012,Concrete Alley,W 23RD ST & W COULTER ST & S SEELEY AVE & S HOYNE,92000.0
25,2012,Miscellaneous Other,18th St / Blue Island & Loomis decorative planter fencing,33443.0
25,2012,Miscellaneous Other,W 18TH ST & S LOOMIS BLVD planting at Independence Plaza,2576.0
